"","tipoI","Date","Account","totalInteractionCount","Likes","Comments","Description","ImageText","URL","Type","FollowersAtPosting","InstagramAccount"
"171",2,"Jun 6, 2021 @ 10:00:18.000","El Líbero","535","486","49","“Todo, todo es mentira”. Gemita Bueno admitió a La Tercera que había faltado a la verdad. Las denuncias que involucraron a Novoa fueron desmentidas por la supuesta testigo clave del hecho
---
Lee la nota completa en el link en nuestra biografía.
---
#ellibero #chile #actualidad #Spiniak #JovinoNovoa","ELLIBERO [ACTUALIDAD] Caso Spiniak: cómo se construyó el fake news que golpeć al fallecido Jovino Novoa.","https://www.instagram.com/p/CPyANgFrzq6/","photo","30,404","elliberocl"
"172",2,"Jun 5, 2021 @ 18:30:07.000","El Líbero","57","57","0","Hay una delgada línea entre la censura ideológica y la identificación real de amenazas externas. Las iniciativas para monitorear el ciberespacio tienen potenciales efectos negativos también sobre el debate político de la pospandemia.

---
Lee la nota completa en el link en nuestra biografía.
---
#ellibero #opinión #CristianGaray #ciberespacio","ELLIBERO [OPINIÓN] «<El << El contro control del ciberespacio se ha vuelto moneda común para que los gobiernos autoritarios y dictaduras ejerzan control respecto de sus poblaciones.» Cristián Garay El control de las fake news: Un arma de doble filo","https://www.instagram.com/p/CPwVwp5LZCE/","photo","30,404","elliberocl"
"173",2,"Jun 5, 2021 @ 15:22:20.000","El Ciudadano","12,083","10,362","1,721","🔴ÚLTIMA HORA: Jacqueline van Rysselberghe se desvincula de la UDI y hace ingreso al Partido Comunista de Chile. 😂
Noticia en desarrollo...
.
.
.
. 
.
.
.

(fake news) .. más son sus declaraciones en un programa de Tv como parte del juego
.
.
,

📹Vía : Subus Chile","(empty)","https://www.instagram.com/p/CPwAOYLBSy4/","video","604,071","el.ciudadano"
"174",2,"Jun 4, 2021 @ 19:26:30.000","T13","8,96","8,724","236","Es definitivo y al parecer sin apelación. Facebook Inc. anunció que Donald Trump se mantendrá baneado en Facebook e Instagram por ""seguridad"" de los usuarios, considerando las noticias falsas que publicó el ex mandatario en redes sociales. Al ex mandatario se le responsabiliza de incitar a la violencia previo a la insurrección en el Capitolio que terminó con 5 personas muertas.

Los detalles, en el link de la bio.","MERIC TACAIN T13 FACEBOOK Cuenta de Donald Trump seguirá cerrada por 2 años por incitación a la violencia T13.CL","https://www.instagram.com/p/CPt3bCIBFti/","photo","1,510,486","teletrece"
"175",2,"Jun 4, 2021 @ 14:22:27.000","Tele13Radio","259","241","18","💻Este viernes, Facebook anunció que suspenderá por dos años la cuenta del  expresidente de Estados Unidos Donald Trump, por incitar a la violencia ante los hechos de enero pasado ocurridos en el Capitolio.

“Dada la gravedad de las circunstancias que llevaron a la suspensión del señor Trump, creemos que sus acciones constituyeron una grave violación de nuestras reglas que merecen la pena más alta disponible bajo los nuevos protocolos”, señaló el vicepresidente de asuntos globales de Facebook, Nick Clegg.

Además, desde la compañía informaron que los políticos serán tratados como otros usuarios cuando vulneren las reglas de la red social, específicamente en caso de desinformación a la ciudadanía. 

#EsHoraDeEscucharnos en Tele13Radio.cl","TELE13 RADIO 103.3FM #EsHoraDeEscucharnos tele1 3radio.cl POR INCITAR cebi A LA VIOLENCIA ANTE HECHOS EN EL CAPITOLIO: FACEBOOK SUSPENDE POR DOS AÑOS LA CUENTA DE DONALD TRUMP","https://www.instagram.com/p/CPtUoJ3rXQl/","photo","144,21","tele13_radio"
"176",2,"May 31, 2021 @ 14:00:54.000","La Nación","15","14","1","Twitter está trabajando en tres etiquetas diferentes para advertir sobre distintos niveles de desinformación en los ‘tuits’, que acompañará de contexto para saber más sobre dicho contenido.

Dependiendo del contenido que se haya compartido en un ‘tuit’, la plataforma mostrará una de las tres etiquetas que actualmente prepara la compañía tecnológica, como ha compartido la experta en ingeniería inversa Jane Manchun Wong.

En su publicación, la desarrolladora muestra tres tipos de etiqueta: Get the latest (obtén lo último), Stay informed (mantente informado) y Misleading (engañoso). Además, la advertencia se acompañará de un enlace donde el usuario podrá acceder a más información de contexto en función también del tipo de contenido que detecte.

La desarrolladora asegura que los trabajos en estas etiquetas son reales, aunque los tuits de ejemplo los ha escrito ella para mostrar en qué situaciones se mostrarían cada una de ellas.

📱Lee más en nuestro sitio web (link en la biografía)

º

º

º

#twitter #detectar #informacion #desarrolladora #desinformacion #loultimo #engañoso #matenteinformado","Search Twitter For you Trending News Sports Fun Trending #KPop United States En N BIP @bip_kpop _kpop 3h We're excited to announce our newest album ""Diamond Lullaby"" today! #KPop Trending in United States Talking Pug Jasi @k9lover85 10h So yes, I've been spending lot of time indoors myself... but 'm pretty sure this pug just said.. Ûg United States Hero Firefighter TWITTER PREPARA TRES NIVELES PARA ADVERTIR SOBRE LA DESINFORMACION QUE DETECTE LANACION.CL","https://www.instagram.com/p/CPi--3wnsaG/","photo","7,792","lanacioncl"
"177",2,"May 30, 2021 @ 16:00:52.000","Radio Duna","67","66","1","La empresa de tecnología informática  Kaspersky en asociación con la empresa de investigación CORPA, publicó  el estudio “La infodemia y su impacto en la vida digital”.

El término infodemia se refiere a la difusión rápida y constante de noticias, tanto reales como falsas, que dificultan la comprensión de un tema.

Según la investigación,  los peruanos (61%) fueron los que más aumentaron el consumo de noticias durante la pandemia, seguidos de los chilenos (53%), argentinos (52%), brasileños (51%), mexicanos (51%) y colombianos (45%). 

En cuanto a la sensación de saturación por exceso de información, los datos sitúan a los usuarios de Colombia en primer lugar (81%), seguidos de argentinos (79%), peruanos (78%), chilenos (77%), brasileños (67%) y mexicanos (62%).

Asimismo, sostiene que “nuestra investigación muestra que muchas personas se sintieron agotadas por el constante flujo de información que, en ocasiones, se contradecía. Lo que experimentamos es similar a un ataque de denegación de servicio (DDoS – ciberataque que intenta sobrecargar un sitio web / servicio con múltiples accesos) a nuestro cerebro, que al saturarse nos genera un apagón mental”.

De hecho, el informe reveló que la sobrecarga de información causó estrés (51%), pesimismo (41%), ansiedad (28%), depresión (33%) e incomodidad (26%) entre los latinoamericanos, contribuyendo al apagón mental.

¿Te has sentido así? En duna.cl recomendaciones para enfrentar la infodemia 📲
.
.
.
#infodemia #covid_19 #estres #pandemia","DUNA.CL Efecto Infodemia: El exceso de información durante la pandemia que ha generado un ""apagón mental""","https://www.instagram.com/p/CPgn6kelURa/","photo","16,302","radioduna"
"178",3,"May 19, 2021 @ 17:16:07.000","Maule Noticias","249","232","17","🔴 Este miércoles el candidato independiente a GORE Francisco Pulgar criticó y negó los rumores que lo relacionaban con el senador y ex alcalde de Talca Juan Castro.

Esto luego de un post que se viralizó en redes sociales. Pulgar mencionó que esto se trataba de una campaña sucia en contra de él y llamó a no caer en la desinformación.

#talca #curico #cauquenes #linares #regiondelmaule #maule","MAULE NOTICIAS Francisco Pulgar: ""Terminemos los discursos de odio. Yo vengo a unir, no voy a caer en una campaña sucia"" MAULENOTICIAS.CL","https://www.instagram.com/p/CPEaa1Sg41s/","video","8,479","maulenoticias"
"179",2,"May 19, 2021 @ 15:01:18.000","Radio Duna","106","103","3","Cerca de 8 mil personas, incluyendo miles de niños, llegaron a España desde las costas de Ceuta, en lo que refiere a la crisis humanitaria más grande de las últimas décadas.

Esto, debido a las disputas armadas que se producen en Marruecos por la organización de el Frente Polisario, que incluye a Argelia y Mauritania.

Ante esto, desde España anunciaron medidas para endurecer los controles migratorios en la frontera marroquí, con Moncloa movilizando a miles de policías para controlar la llegada de migrantes. Además, se realizó un llamado a Marruecos para un mayor control y contención de las familias que dejan el país.

En Ahora en Duna, el Nicolas Castellano, periodista de la cadena Ser especializado en migraciones, sostuvo que “es verdad que la sociedad española como la sociedad europea está muy polarizada con la realidad migratoria, porque la manipulación y las noticias falsas hacen que la gente crea las fake news”

Créditos video: @elmundo_es 

.
.
.
#ceuta #españa #crisismigratoria #marruecos","DUNA.CL Emotiva imagen desde Ceuta Crisis en Ceuta: El emotivo abrazo entre una voluntaria de la Cruz Roja y un migrante que logró cruzar el mar","https://www.instagram.com/p/CPEMUmGAmS7/","video","16,302","radioduna"
"180",3,"May 19, 2021 @ 13:37:57.000","Maule Noticias","1","1","0","🎙 El candidato independiente a la Gobernación Regional por el Maule desmiente rumores sobre un patrocinio con el senador Juan Castro y llama a no caer en noticias falsas.

#talca #curico #linares #cauquenes #regiondelmaule","(empty)","https://www.instagram.com/tv/CPECyyKAgwy/","video","8,479","maulenoticias"
"181",2,"May 17, 2021 @ 17:47:41.000","24horascl","13,589","13,095","494","Solo 12 personas son responsables de la mayor parte de la propaganda antivacunas publicada en tres de los principales medios de comunicación social, según un estudio de un grupo con sede en Londres que se opone al odio y la desinformación en línea.

Así, los investigadores descubrieron que la mayoría de las conspiraciones antivacunas que circulan en las redes sociales pueden ser rastreadas hasta un mero puñado de cuentas individuales que representan a personalidades antivacunas prominentes.","24>HORAS SEGÚN ESTUDIO LA MAYORÍA DE CONSPIRACIONES ANTIVACUNAS EN INTERNET PROVIENEN DE LAS MISMAS 12 PERSONAS","https://www.instagram.com/p/CO_VzlpBb-8/","photo","1,228,849","24horascl"
"182",1,"May 16, 2021 @ 19:26:26.000","Prensa Los Lagos","68","68","0","Se reportan que algunas mesas han empezado el conteo de votos de los alcaldes. Según estaba previsto, el recuento de votos iniciaría por el de los constituyentes. Sin embargo, debido a desorganización y desinformación por parte de los vocales, dieron inicio al conteo de votos de los alcaldes en al menos 3 mesas en la comuna de #PuertoMontt y #Castro. 

Una de estas mesas es la mesa 102 del Liceo de Hombres de Puerto Montt, la cual acaba de terminó el conteo, que terminó con 60 votos para Rodrigo Wainraihgt y 54 para el actual alcalde Gervoy Paredes. En la mesa número 18 del Liceo de Niñas se vive algo similar. En esta mesa, se contabilizó 55 votos para Wainraihgt y 57 para Paredes. También se reportan otros casos dentro de la Región de Los Lagos en comunas como Castro.","D Grupo DiarioSur INFORMA VEL 中究 Y ALGUNAS MESAS CONTARON VOTOS DE ALCALDES Y CONCEJALES www.diariodepuertomontt.cl","https://www.instagram.com/p/CO88TYfKNrX/","photo","3,925","prensaloslagos"
"183",2,"May 16, 2021 @ 13:29:47.000","Página 7","138","136","2","Durante esta jornada de elecciones han circulado distintas noticias y momentos memorables respecto al proceso democrático, sin embargo, también se ha difundido información falsa.

Así al menos lo afirmó el Servicio Electoral de Chile a través de sus redes sociales, donde aclaron una noticia falsa que se ha viralizado en algunas plataformas.

Se trata de una cédula electoral correspondiente a la comuna de Lo Espejo, con la que se denuncia que no aparecerían todos los candidatos a alcalde.

“Está circulando una fotografía de una cédula electoral de la comuna de Lo Espejo señalando que faltan candidatos impresos en ella”, manifestó el Servel, adjuntando una imagen difuminada con la palabra “Falso”.

Para más detalles, pincha el link de nuestra BIO. 

#elecciones2021 #página7 #página7chile","Página 7 FALS SO SERVEL ACLARA 'FAKE NEWS' SOBRE ERROR DE CÉDULA ELECTORAL EN LO ESPEJO: ""ESTÁN CORRECTAMENTE IMPRESAS""","https://www.instagram.com/p/CO8TfyVrjTL/","photo","109,879","pagina7chile"
"184",2,"May 15, 2021 @ 16:47:10.000","Página 7","276","272","4","Justo en medio de las jornadas de elecciones, comenzó a difundirse por redes sociales una campaña que buscaba que los votantes utilizaran ‘la Quinta Papeleta’ a la hora de sufragar.

Según explicaron varios perfiles de Instagram y Twitter, además de las papeletas de alcaldes, gobernadores, concejales y constituyentes, los electores podían llevar desde sus casas un quinto voto que podía ser incluido dentro de las urnas.

Esta incluye la pregunta si quiere que el Presidente Piñera sea destituido o no. La idea es que la persona introduzca este ‘voto’ dentro de cualquiera de los otros, para que luego sea contabilizado al final del proceso.

El problema de esto es que se puede estar incurriendo en un delito, según detalla el Servicio Electoral. Primero hay que dejar en claro que si ‘la Quinta Papeleta’ es descubierta en el conteo final, no debería objetar el voto real del ciudadano.

Esto porque no influiría en la preferencia de los alcaldes, concejales, gobernadores y constituyentes. Sin embargo, hay un aspecto legal que no se está considerando.
Para más detalles, pincha el link en la BIO.
#pagina7 #pagina7chile","Página 7 TER VEL SER ER FAKE NEWS: SERVEL DICE QUE QUINTA PAPELETA' CONTRA PIÑERA 'NO ES LEGAL'Y QUE PUEDE GENERAR UNA SANCIÓN","https://www.instagram.com/p/CO6FSmmjB3q/","photo","109,879","pagina7chile"
"185",2,"Apr 24, 2021 @ 16:56:51.000","CIPER Chile","908","837","71","Lea CIPER Académico, para que lo vea venir 👉 bit.ly/3nkiZW8","CIPER ACADÉMICO OPINIÓN Pandemia de desinformación: combatiendo teorías conspirativas con la economía del comportamiento Quienes difunden teorías conspirativas terminan afectando las políticas públicas para controlar la pandemia. Los autores traen a la mesa estrategias de la economía conductual para comprender las conductas no-cooperativas evaluar soluciones compatibles con las libertades individuales. Opinión de Pablo Paniagua (PhD. en Economía Política de Londres) y Exequiel Cáceres (Fundación Para el Progreso.)","https://www.instagram.com/p/COEBtFGlMUY/","photo","407,19","ciper_chile"
"186",2,"Apr 23, 2021 @ 17:03:55.000","Revista El Periodista","30","30","0","La académica fue galardonada en la conferencia científica internacional más importante sobre investigación Web por su trabajo «Information credibility on Twitter». A diez años de su publicación original, esta investigación es considerada pieza fundamental en el estudio formal del problema de las «fake news».

📲 Encuentra todos los detalles en www.elperiodista.cl","ep Bárbara Poblete recibió el Test of Time Award por investigación sobre propagación de rumores en redes sociales","https://www.instagram.com/p/COBduC8JIYJ/","photo","3,545","epelperiodista"
"187",1,"Apr 21, 2021 @ 15:10:37.000","Juanito Perez","0","0","0","Consejo de la Transparencia abordó desafíos de la libertad de expresión, desinformación y confianza junto a expertos internacionales.","SEMINARIO INTERNACIONAL CIUDADANÍA INFORMADA En Vivo Transparencia UN ACTOR PARA EL FUTURO DE LA DEMOCRACIA LIBERTAD DE EXPRESIÓN, DESINFORMACIÓN Y DEMOCRACIA Consejo para la Transparencia Chile @ctransparencia actransparencia www.consejotransparencia.cl Colabora CONGRESO FUTURO","https://www.instagram.com/p/CN8HKfel4Wy/","photo","4,513","canal_21tv"
"188",2,"Apr 20, 2021 @ 23:38:49.000","CIPER Chile","13,658","13,29","368","Este es el documento, publicado por CIPER, que firmó el magistrado Juan Poblete y que permitió al Ejército interceptar el teléfono del periodista Mauricio Weibel. El documento contiene información falsa. 

El número de celular que aparece en el documento es el de Weibel, pero se presenta como el teléfono de una ""agente extranjera"" que está recabando información sobre el Ejército que comprometería la seguridad nacional. En realidad, Weibel reporteaba corrupción entre altos oficiales del Ejército. CIPER intentó hablar con el juez Poblete antes y después de publicar el reportaje que difundió este documento, pero no aceptó.

Este martes 20 el juez Poblete acudió a la Cámara de Diputados y habría señalado, según La Tercera, que no fue engañado y que sabía que era Weibel el que sería interceptado. A la Cámara también fueron dos ex jefes de Inteligencia del Ejército, quienes habrían dicho que el periodista no aparecía en el documento para que la información no se filtrara desde el Poder Judicial.

Hasta ahora, ni el juez Poblete ni los ex jefes militares han aclarado por qué el Ejército necesitaba espiar a un periodista que cubría casos de corrupción militar.","(empty)","https://www.instagram.com/p/CN6chwJpJdN/","photo","407,19","ciper_chile"
"189",2,"Apr 9, 2021 @ 16:20:14.000","Radio ADN","386","368","18","El municipio indicó que la denuncia realizada por un medio local corresponde a “fake news”, y que se trataba de una reunión de trabajo.

Puedes revisar más detalles en el link de nuestro perfil.","ADN NOTICIAS Fiscalía investigará posible ""delito contra la salud pública"" de Cathy Barriga por supuesta celebración de cumpleaños en Cuarentena","https://www.instagram.com/p/CNdVlyHM72J/","photo","439,766","adnchile"
"190",1,"Apr 9, 2021 @ 13:21:51.000","Diario En La Línea (Calama)","95","90","5","¡Noticia falsa!
Esa información es antigua. Para este fin de semana se puede utilizar UN permiso de desplazamiento en las comunas en Paso 1 y Paso 2. #CALAMA","24>HORAS •ÚLTIMO MINUTO MINSAL SUSPENDE PERMISO DE DESPLAZAMIENTO PERSONAL PARA FINES DE SEMANA ¿QUÉ QUIERE DECIR ESTO? SE SUSPENDERÁ EL PERMISO DE DESPLAZAMIENTO PERSONAL DURANTE LOS FINES DE SEMANA Y FESTIVOS, PARA LAS COMUNAS QUE ESTÉN EN CUARENTENA Ο TRANSICIÓN ""HAY CIERTOS SERVICIOS BÁSICOS QUE VAN ESTAR FUNCIONANDO PERO TANTO LAS FERIAS LIBRES COMO LOS SUPERMERCADOS, LOS QUE VENDEN ALIMENTOS, VAN A PODER FUNCIONAR EL FIN DE SEMANA SOLO PARA DELIVERY"", DIJO LA SUBSECRETARIA PAULA DAZA.","https://www.instagram.com/p/CNdBLS3FGRH/","photo","6,228","enlalinea.cl"
"191",2,"Apr 9, 2021 @ 10:58:39.000","24horascl","1,691","1,603","88","A través de un comunicado, la Municipalidad de Maipú se refirió a la denuncia de la supuesta celebración de cumpleaños realizada por la alcaldesa, Cathy Barriga.

El documento sostiene que ello “responde a una fake news, y se debe aclarar que la autoridad comunal tiene reuniones períodicamente en recintos abiertos como la Pista de Patinaje Los Toros y la Granja Alimentaria, pensados en resguardar la seguridad de todos”.

En ese mismo sentido, enfatizaron que la actividad en cuestión, “responde a reuniones de equipos municipales que llevan meses trabajando durante esta pandemia, en jornada de entrega de apoyo fiscal, a familias COVID y de vacunación, las que se seguirán realizando tomando todas las medidas de seguridad”.

La denuncia fue hecha por La Voz de Maipú, portal que aseguró que la alcaldesa envió una invitación a sus funcionarias y que el festejo tendría lugar la tarde del jueves en el Parque Municipal.

Según los registros que poseen, Barriga no estaba en el lugar y se podía apreciar a personas con mascarillas y bailando.

La alcaldesa está de cumpleaños este 9 de abril.","(empty)","https://www.instagram.com/p/CNcwydUBCg0/","photo","1,228,849","24horascl"
"192",1,"Apr 8, 2021 @ 09:29:55.000","Radio Santa Cruz FM 94.3","4","4","0","🔴¡Ojo con las fake news! 
Se Informa desde Salud que el sitio web http://mevacuno.cl NO entrega certificados de vacunación ni tampoco significa un robo de información personal o de la ClaveÚnica. No confíes en toda la información que ves en redes sociales.","No caigas en las fake news e infórmate por los canales oficiales El sitio www.mevacuno.cl te entrega información personalizada sobre la fecha, vacunatorio y tipo de vacuna contra COVID-19 correspondiente. TUNGUIBRE Recibirás recordatorios de segundas dosis, encuestas y la descarga de un comprobante del proceso de vacunación, que debes acceder con tu ClaveÚnica. sCampara MlAgenda Gesloen Esta página NO entrega certificados de vacunación ni tampoco significa un robo de información personal. @MeVacuno","https://www.instagram.com/p/CNaB1ueLciP/","photo","3,43","radiosantacruzfm"
"193",2,"Apr 3, 2021 @ 09:23:27.000","Diario El Mostrador","962","895","67","Una serie de rumores acerca de la posibilidad de un golpe en Brasilia comenzaron a circular, poco creíbles para quienes se concentran en el origen castrense del mandatario -capitán de Ejército antes de sus tres décadas como parlamentario- o en la alta presencia militar al frente de los ministerios. Desde luego el infundio es parte de las fake news, sin embargo, hay que considerar que cierto murmullo público puede ser demostrativo de que algo ocurre, por lo que se suele llenar el vacío de información incompleta con historias de diverso tipo, para así comprender lo que se desconoce. “Lo verdadero y lo falso siempre van mezclados entre sí, aunque en diferentes proporciones”, decía el historiador y antropólogo ruso Lev Gumilev.

La opinión completa en el link de la bio ❗️","OPINIÓN Rumores de golpe de Estado en Brasil: ¿solo humo? por Gilberto Aranda B.","https://www.instagram.com/p/CNNCQeVsDiV/","photo","453,584","el_mostrador"
"194",3,"Apr 3, 2021 @ 08:00:14.000","Diario Concepción","73","72","1","¡Buenos días! Esta es la portada de Diario Concepción para este sábado 3 de abril. Más noticias en http://www.diarioconcepcion.cl","Municipales 2021: Cinco opostulantes compiten porla regional DORE n.unplanoreguladoramedi lac listas Asamblea Popular Constituyentey Unión Patriótica paral Convención Constituyente Diario Concepción Sábado Û Mejor comunicación de riesgo sería clave para bajar contagios Exitismo en vacunación desinformación sobre jugador a del cometidos. Lautaro: Vial tomará parte la denuncia UdeC inicia primera etapa del Plan Ciencia 2030 presentó Sepide diadde duveformaciónde dinteol Crece el temor de caer en la pobreza medio de la crisis sanitaria económica EDITORIAL: ECONOMÍA&NEGOCIOSPÁG.12 DELAS REGIONES""","https://www.instagram.com/p/CNM4uxGrluO/","photo","60,901","diarioconcepcion"
"195",2,"Apr 2, 2021 @ 15:00:52.000","PrensaFutbol","180","171","9","Pide su desafiliación: ANFP denunció a Lautaro de Buin al Tribunal de Penalidades por inclumplimiento laboral, por lo que el recién ascendido podría quedar rápidamente fuera de competencia.
💻 Infórmate en www.prensafutbol.cl y su app para móviles📲
-

#Prensafutbol #ElShowDePrensafutbol #PrenZafutbol #LigaPrensaFutbol #Chile #futbol #soccer","prensa UBO IKRI DIRECTORIO DE LA ANFP PIDE DESAFILIACIÓN DE LAUTARO DE BUIN POR INCUMPLIMIENTO LABORAL EL ENTE DICE QUE EL CLUB PRESENTÓ INFORMACIÓN FALSA DE CONTRATOS","https://www.instagram.com/p/CNLEE_rn-g7/","photo","52,87","prensafutbol"
"196",2,"Apr 1, 2021 @ 08:53:54.000","The Clinic","2,516","2,258","258","#Actualidad 📰 | Sus teorías se contradicen entre sí: Esta es la red de médicos negacionistas del Covid-19 que existe en el mundo 🔷 Esa agrupación conforma junto a otras entidades una amalgama de redes sin una estructura organizativa clara, convertida en una maraña de desinformación en la que confluyen diferentes portavoces, cada uno con una teoría propia, que en ocasiones se contradice con las de los demás.
✍️ Por EFE/The Clinic.
👉 Lee la nota completa en el link de nuestra bio 📲.
#medicos #medicina #chilegram #Chile #TheClinic
https://bit.ly/3wh3MJz","THE CLINIC 76 4 F 97 36.1 6 #Actuidad Sus teorías se contradicen entre sí: Esta es la red de médicos negacionistas del Covid-19 que existe en el mundo","https://www.instagram.com/p/CNH1SSRJT5Z/","photo","546,238","theclinic_cl"
"197",2,"Mar 31, 2021 @ 12:23:03.000","Resumen","517","471","46","Durante punto de prensa por llegada de carga de vacunas #Pfizer, el ministro #EnriqueParis insiste en culpar a la población por el desastre sanitario y trata de noticias falsas publicaciones del #WashingtonPost y #NewYorkTimes que critican estrategia del Gobierno en transmitir falsa sensación de seguridad con las vacunas
.
#Pandemia #Coronavirus #Chile #CoronavirusChile #Resumen","DIRECTO GOBIERNO EVALUA Plan Nacional de Vacunación Covid-19","https://www.instagram.com/tv/CNFoZq8Do0G/","video","80,282","resumen.cl"
"198",2,"Mar 31, 2021 @ 10:43:12.000","Resumen","1,685","1,659","26","El doctor Eric Feigl-Ding, epidemiólogo de la Universidad de #Harvard, escribió un detallado hilo en Twitter para explicar la crítica situación que vive #Chile en cantidad de contagios, muertes y ocupación de camas UCI pese a avance de vacunación, apuntando a la estrategia del Gobierno en centrar su plan solamente en las vacunas. Asimismo, el #NewYorkTimes y #WashingtonPost, los medios más importantes de #EEUU, publicaron textos en la misma línea, los que esta mañana el ministro Paris calificó de «noticias falsas»
.
Léelo en Resumen.cl
.
#Chile #Coronavirus #UniversidadDeHarvard #pandemia #Piñera #EnriqueParis #Resumen","(empty)","https://www.instagram.com/p/CNFc__ZLGoA/","album","80,282","resumen.cl"
