"","tipoI","Date","Account","totalInteractionCount","Likes","Comments","Description","ImageText","URL","Type","FollowersAtPosting","InstagramAccount"
"493",1,"Dec 6, 2019 @ 03:06:57.000","Diario En La Línea (Calama)","2","2","0","www.enlalinea.cl | Periodistas y vecinos de Calama conocieron más de las “Fake News” y su proliferación durante el estallido social http://enlalinea.cl/periodistas-y-vecinos-de-calama-conocieron-mas-de-las-fake-news-y-su-proliferacion-durante-el-estallido-social/","(empty)","https://www.instagram.com/p/B5uGbZdlEbU/","photo","6,226","enlalinea.cl"
"494",1,"Dec 4, 2019 @ 21:16:26.000","Juanito Perez","3","3","0","(empty)","oete FAKE NEWS ១ Estudio indica que jóvenes entre 18 y 24 años son más propensos a cree creer noticias falsas meganoticias.cl","https://www.instagram.com/p/B5q5hUxFyUU/","photo","4,513","canal_21tv"
"495",2,"Dec 4, 2019 @ 20:43:41.000","Meganoticias","11,685","10,723","962","Un estudio de opinión realizado por miembros de la Facultad de Comunicaciones de la Universidad Católica, dio luces sobre el comportamiento de los chilenos sobre las #FakeNews que circularon en medio de la crisis social. Entre las principales conclusiones se encuentra que en el país se cree más en fake news que en Estados Unidos, o que los jóvenes son más propensos a darle credibilidad a noticias que son falsas o imprecisas. Revisa la nota completa en nuestro sitio web www.meganoticias.cl 💻 ¿Qué te parece?","FAKE NEWS ១ Estudio indica que jóvenes entre 18 y 24 años son más propensos a creer noticias falsas meganoticias.cl","https://www.instagram.com/p/B5q1xa-gMQ-/","photo","2,652,893","meganoticiascl"
"496",3,"Nov 29, 2019 @ 17:23:19.000","Diario Concepción","63","57","6","FALSO: No existe Carolina Muñoz Manguello, supuesta penquista desaparecida luego de ser detenida.

El video de la detención de Alejandro Muñoz se ha viralizado, pero por motivos equivocados: supuestamente sería el registro de la detención de Carolina Muñoz Manguello, mujer que ""estaría desaparecida"" luego de ser aprehendida. Esta noticia falsa ha recorrido el mundo entero, generando titulares en medios de distintos países y ha atraído la atención de las redes sociales.

@tvu_television @radioudec @ladiscusion.cl","(empty)","https://www.instagram.com/p/B5dm3iQHt_I/","photo","60,913","diarioconcepcion"
"497",2,"Nov 21, 2019 @ 16:26:54.000","Agricultura","131","117","14","La directiva de la Asociación de Radiodifusores de Chile (Archi) se reunió en La Moneda con la ministra Secretaria General de Gobierno, Karla Rubilar. La vocera de Palacio y los representantes de las radios encabezaron una mesa de trabajo por la Paz por Chile. La vicepresidenta de la Archi y gerenta general de Radio Agricultura, Vesna Radnic, aseguró que en la oportunidad se abordó “el contexto social y cómo combatir las noticias falsas”. La Archi representa 1.200 radios en todo Chile.","(empty)","https://www.instagram.com/p/B5I6DSYAfxI/","photo","67,48","radioagricultura"
"498",3,"Nov 19, 2019 @ 19:00:20.000","Diario Concepción","64","55","9","Nueva sección ""Verificación de noticias"":
En Diario Concepción, nuestro compromiso es con con nuestros lectores y lectoras, y con la calidad de los contenidos entregados. Por ello, hemos habilitado una nueva sección de ""fact checking"" o verificación de datos, cuyo propósito es lidiar con la desinformación causada por las tristemente célebres ""noticias falsas"". Les invitamos a revisar esta sección, así como a enviarnos todas las informaciones que encuentren en redes sociales y cuyo contenido les parezca ""dudoso"" o falso. Nosotros lo verificaremos para compartir los resultados con toda la comunidad.","(empty)","https://www.instagram.com/p/B5ECBZtHvKg/","photo","60,913","diarioconcepcion"
"499",2,"Nov 19, 2019 @ 10:54:01.000","24horascl","25,868","25,043","825","El Colegio de Químicos Farmacéuticos y Bioquímicos, la Facultad de Ciencias Químicas y Farmacéuticas de la Universidad de Chile y el científico Claudio Olea Azar, doctor en Ciencias con mención Química, explicaron que el Mentholatum no tiene ningún efecto paliativo frente a los gases lacrimógenos.

De esta forma, el documento refuta lo expuesto por la jefa de Derechos Humanos de Carabineros, teniente coronel Karina Soza, la que aseguró ante la Comisión de DD.HH. del Senado que ante registros de efectivos inhalando una sustancia desconocida, se trabaja de mentholatum en polvo para evitar los efectos de los gases. ""A los carabineros nos afecta exactamente igual que a todas las personas el gas lacrimógeno, y la única manera que hemos encontrado para hacerlo tal como otras personas comen limón, toman leche, se limpian la cara con agua, nosotros ocupamos Mentholatum, y era eso lo que los funcionarios estaban haciendo ese día"", aseveró la teniente.

Por ello, los científicos aseguraron que ""el uso de Mentholatum​ de forma tópica en la nariz o zonas cercanas, y/o la inhalación del mismo, produciría una descongestión de las vías respiratorias, facilitando por tanto la inhalación del gas lacrimógeno"". Además, ""los componentes del Mentholatum​ (tales como el mentol) podrían eventualmente causar irritación, por lo que se corre el riesgo de potenciar el efecto del gas. Por último, las partículas contenidas en el gas lacrimógeno se adhieren a superficies grasas (tal como lo es el Mentholatum​ ​de uso tópico​), empeorando el efecto irritante producido por las lacrimógenas sobre la piel"", detalla el documento publicado.

Por último,  precisaron que ""la evidencia científica existente demuestra que el Mentholatum​ no posee ninguna propiedad que ayude a combatir el efecto de los gases lacrimógenos, nos parece sumamente grave e irresponsable la declaración emitida por la Teniente Coronel Karina Soza, pues propicia la ignorancia y desinformación de la población con sus palabras. Palabras que a la fecha no han sido rectificadas por la institución en ningún comunicado o declaración oficial"".","(empty)","https://www.instagram.com/p/B5DKXb9F_-v/","photo","1,229,054","24horascl"
"500",2,"Nov 18, 2019 @ 15:08:31.000","Diario El Mostrador","523","487","36","Los hechos del último mes me sorprenden fuera de Chile y en un principio logran motivar al revolucionario que llevo dentro y tomo la causa de la calle. Me parecía justo y necesario que se hicieran oír voces postergadas y mudas para los tecnócratas. Hace rato que con amigos filósofos y librepensadores veníamos riéndonos de lo que significa apoyar ciegamente un sistema que promueve la felicidad de la farmacopeia por sobre la de la fase REM, entre su dirigencia y la disciplina ciega entre sus dirigidos. Nos llamaba la atención también las caras de culo de los autos más caros del taco. O sea, había razón para creer que un poco de revuelta era, en verdad, “Justo y Necesario”. Y sigo creyendo lo mismo. Debe ser por la parentela que fue Milicia Republicana, o por deberle el nombre a la muerte de un homónimo de neumonía mientras mi familia se dirigía al exilio en barco. La gente pide que vuelvan y obligan a Ibáñez a bancarse un nuevo período presidencial con fuerza popular, y nunca un miembro de mi familia ha defendido el exilio, ni han dejado de estar en el Congreso. Son conocidas las razones por las cuales Pinochet termina sacando a Jorge Alessandri Rodríguez del Consejo de Estado. Y no es materia para detallar en esta columna.

Lo que no podía prever es que lo que parte como razones entendibles y que hasta justifican la fuerza y la desobediencia civil, termine transformándose en una turba embravecida, sin norte claro y con muchos tratando de sacar dividendos políticos de ello.  Al final, yo, como parece que también la mayoría del país, tiendo a estar más cerca de Thoreau que del Ché, por razones obvias.

Creo que como cualquiera que lea estas palabras, oí y leí todas las tesis posibles. Y en múltiples formatos. Algo a lo que tendremos que ir acostumbrándonos en esta era de protagonismos de Red Social y Fake News.","(empty)","https://www.instagram.com/p/B5BCsn0JIN6/","photo","453,71","el_mostrador"
"501",2,"Nov 16, 2019 @ 19:07:31.000","24horascl","4,595","4,412","183","""Hay un sitio que es conocido por publicar noticias falsas. Hoy me tocó a mí"". El futbolista nacional Arturo Vidal desmintió en su cuenta de Instagram una polémica frase viralizada durante la mañana del 16 de noviembre en la que supuestamente afirmaba que en Chile se ""puede vivir con 300 lucas"". Según un sitio conocido por subir contenido futbolístico, Vidal afirmó que ""uno vive con 300 lukas en Chile porque es un país barato. Yo igual ganaba 300 mil cuando comencé en Colo Colo. Pero apoyo a la gente en sus reclamos"". Respecto al tema Vidal escribió en la red social que ""publican una noticia 100% falsa"". ""¿A quién se le puede ocurrir que yo pueda decir esas cosas? Sé que nadie inteligente puede creer eso, pero es mi obligación aclararlo y aquí lo hago"", agregó.","(empty)","https://www.instagram.com/p/B48UdShFKPt/","photo","1,229,054","24horascl"
"502",2,"Nov 13, 2019 @ 23:02:42.000","La Izquierda Diario Chile","2,327","2,292","35","IMPORTANTE DIFUNDIR
En el marco del cumplimiento de un año del asesinato a Camilo Catrillanca por policías del comando jungla se ha echado a correr esta información FALSA, con rasgos de buscar infundir miedo en la población y de que decaigan las movilizaciones.

#Catrillanca #CamiloCatrillanca #ChileDesperto #FueraPiñera #HuelgaGeneral #Mapuche","(empty)","https://www.instagram.com/p/B41A_TppRee/","album","76,516","laizquierdadiariocl"
"503",1,"Nov 13, 2019 @ 22:55:01.000","Diario El Cachapoal","8","8","0","Durante las manifestaciones ciudadanas 50 extranjeros deberán ser deportados en O’Higgins.  Por Carolina Pérez Araya 
Las noticias falsas se han tomado las redes sociales, por lo mismo se hace un llamado a buscar y compartir información de medios de comunicación nacionales y regionales, el que más se adecúe a su criterio.

Entre la información que se ha generado, es la vinculación de extranjeros en los hechos de mayor violencia a nivel nacional, lo que no habíamos podido confirmar, por estar muchos de los casos en plena investigación... #intendenciaohiggins #deportados #manifestacioneschile","(empty)","https://www.instagram.com/p/B41AHAHAhzv/","photo","1,865","elcachapoal"
"504",2,"Nov 13, 2019 @ 15:00:37.000","LUN","301","248","53","Paulina Núñez: ""Me da pena que ocupen esta fotografía para una fake news"", aclara la diputada sobre imagen que fue difundida por Instagram.
http://bit.ly/2NH79oZ","(empty)","https://www.instagram.com/p/B40J0V0HUH-/","photo","432,039","lungram"
"505",2,"Nov 11, 2019 @ 17:56:43.000","La Tercera","401","366","35","Radiografía de una fake news | En estas semanas, a no pocos chilenos les ocurrió esto: recibir, creer e incluso compartir una noticia que luego terminaba siendo falsa. Eran historias en apariencia atractivas -mensajes, audios, videos, imágenes- que se divulgaban velozmente entre los usuarios de redes sociales, quienes de manera inmediata -desde un impulso que es básicamente emocional- creen que lo que leen es real. Pero no.⁠⠀
⁠⠀
Incendios que nunca fueron registrados o videos fuera de contexto son algunos mensajes que se han reproducido, llenando las redes sociales de noticias rápidas, virales y falsas. ⁠⠀
⁠⠀
Dos expertas, de la Universidad de Harvard y la Universidad de Columbia, analizan la anatomía de las fake news, donde la emoción tiene un rol clave. Ambas coinciden en que hoy Chile es terreno fértil para la desinformación.⁠⠀
⁠⠀
Revisa todo el contenido en el link de nuestra bio o deslizando en las stories. ⁠⠀","(empty)","https://www.instagram.com/p/B4vUYZzBmTL/","photo","400,764","laterceracom"
"506",2,"Nov 11, 2019 @ 17:46:48.000","Resumen","720","713","7","La desinformación por parte de los grandes #medios de comunicación ha sido parte del movimiento desde su inicio: Criminalización, #información sesgada, invisibilizar las demandas y centrarse en el daños materiales, usar imágenes de archivo y hacer creer que es en vivo, repetir constantemente una imagen, intentar dividir entre «manifestantes buenos» y «manifestantes malos» bajos sus criterios morales, y otras tantas veces derechamente mentir. Tal ese el caso de una nota en el noticiero central de #TVN el día de ayer que presentó un supuesto incendio a un banco acusando a manifestante con burdos efectos de fuego que analizamos en Resumen.cl (LINK EN LA BIO)

#Banco #Chile #FakeNews #Fuego #MediosdeComunicación #Mentiras #Noticiasfalsas #Televisión #TV #Noticias #Resumen","(empty)","https://www.instagram.com/p/B4vTPy-HJSK/","photo","80,322","resumen.cl"
"507",2,"Nov 8, 2019 @ 16:05:58.000","Página 7","2,11","1,861","249","Fue el pasado jueves cuando el matinal Mucho Gusto de Mega, emitió una entrevista a Natalia Aravena, un joven que recibió una bomba lacrimógena en su ojo derecho durante una marcha pacífica.
.
Sin embargo, las fotografías exhibidas en el espacio matutino y compartidas en redes sociales, fueron cuestionadas por algunos usuarios, ya que la afectada aparecía con un parche en el lado izquierdo de su cara. De este modo, fue acusada de montaje.
.
Con respecto a estos comentarios, Aravena aclaró la situación en el matinal Contigo en La Mañana de Chilevisión. “Yo subí algunas imágenes y por el efecto de la selfie, salieron en modo espejo, o sea al revés. Entonces hay mucha gente cuestionando que no me decido cuál es el ojo afectado”, precisó.
.
Asimismo, declaró que quienes han divulgado esta información falsa por redes sociales, “son personal de Carabineros de Chile y de las Fuerzas Armadas”.
.
“Me parece vergonzoso que ellos estén atacando a la gente directamente y que además de eso estén burlándose de nosotros y de lo que nos hicieron”, finalizó.

#Página7Chile #Página7","(empty)","https://www.instagram.com/p/B4nZUkvgfrt/","photo","109,886","pagina7chile"
"508",2,"Nov 5, 2019 @ 11:17:13.000","Diario El Mostrador","1,936","1,908","28","@elmostrador_cultura Joker, la película galardonada con el León de Oro en Venecia y que fue la Perla sorpresa del Zinemaldia de 2019, ha resultado ser una cinta muy polémica por poner encima de la mesa temas muy complejos. El filme plantea problemas de gran calado, que desafortunadamente son muy actuales, como por ejemplo la soledad y el engaño, los trastornos mentales y la confusión del mundo real con el imaginario, las noticias falsas y el fingimiento continuo, el desprecio hacia lo diferente y los estallidos de violencia social.

Durante dos horas nos hace meternos en la piel del personaje y experimentar su inquietante desazón, acompañados de una excelente banda sonora. Repasemos algunas de las cuestiones que sugiere.
Una subida en el precio del combustible o en el billete de metro pueden ser las gotas que desbordan los vasos del descontento, provocando repentinas revueltas, como testimonian lo sucedido en Francia con el movimiento de los chalecos amarillos o en ese Chile que merced al golpe de Pinochet sirvió como laboratorio a la economía ultra-neoliberal expandida luego por doquier.
Corren malos tiempos para las expectativas de los más jóvenes, condenados en general a vivir peor que sus padres y a sufrir las imposiciones de un mercado laboral cuya inherente precariedad les hurta hacer planes vitales como el emanciparse o tener hijos.
Todo ello hace que la tasa de natalidad merme, mientras que los avances médicos propician un progresivo envejecimiento de la población. Una bomba de relojería que la más insignificante chispa puede activar en cualquier momento.
☑️ Nota completa en 
www.elmostrador.cl/cultura (link en el perfil o en nuestras historias) #joker #cine #descontentosocial #manifestaciones  #cultura  #elmostrador #chile @el_mostrador","(empty)","https://www.instagram.com/p/B4fJ5GDJuqJ/","photo","453,71","el_mostrador"
"509",2,"Nov 2, 2019 @ 14:49:34.000","Diario El Mostrador","4,475","3,982","493","Durante la tarde de este sábado comenzó a circular el hashtag #fueraSharp en Twitter, reclamos contra la gestión del jefe comunal frente a los destrozos en el marco del estallido social que sacude al país.

Sin embargo, y luego de que el hashtag llegara a lo más alto del trending topic, el alcalde de Valparaíso, Jorge Sharp, denunció una ""operación de la derecha"" en su contra a través de la red social.

Y es que la tendencia incluyó la difusión de ""fake news"" en las que incluso acusaban al alcalde de haber participado en destrozos.

Frente a esto, Jorge Sharp apuntó directamente al excandidato presidencial y líder de Acción Republicana, José Antonio Kast, quien publicó varios mensajes con el citado hashtag. ""Durante la tarde comenzó una operación de la derecha en tuiter. Sabíamos que había alguien detrás hasta que lo encontramos. Su apellido empieza con K"", señaló Sharp en un tuit.

Cabe mencionar que transcurridas las horas, otro hashtag comenzó a circular. #AguanteSharp superó con creces a la anterior consigna y brindó apoyo al jefe comunal frenteamplista.

Agradezco a los que levantaron la campaña #AguanteSharp ¡Lo importante es con todas y todos alcancemos la AC para cambiar Chile!"", añadió el alcalde.","PAÍS #FueraSharp: la ""operación de la derecha"" que denunció Jorge Sharp en Twitter por El Mostrador 2 noviembre, 2019","https://www.instagram.com/p/B4XzzxkJNz1/","photo","453,71","el_mostrador"
"510",2,"Oct 29, 2019 @ 04:14:16.000","24horascl","8,682","7,611","1,071","El general director de la institución policial se refirió en #MejorHablarTVN al cuestionamiento por el actuar de los uniformados durante las manifestaciones masivas a lo largo del país.

Respecto a las acusaciones de tortura, Rozas indicó que ""hasta ahora no hay nada que dé cuenta. Yo tomo la denuncia y el tribunal debe decir si hubo o no, y si hubo se asumirá la responsabilidad personal y se adoptarán los cursos de acción que así se ameriten"". ""Los carabineros no somos formados para dañar a las personas, pero también hay que actuar con justicia y consecuencia. El ramo, la cátedra de Derechos Humanos, es muy importante para nosotros. Yo tengo la certeza de que mis carabineros están actuando de acuerdo a la norma"", agregó.

Finalmente, Rozas sostuvo que ""en estos días ha circulado una serie de noticias falsas que nos quieren afectar, nos quieren dividir (...) Aprovecho esta instancia de apoyar y respaldar a nuestros funcionarios"".","(empty)","https://www.instagram.com/p/B4MX7K9lNs-/","album","1,229,054","24horascl"
"511",2,"Oct 28, 2019 @ 23:00:47.000","BioBioChile","9,965","9,708","257","Ojo con las fake news. Este lunes en redes sociales, se aseguraba que el polémico TPP-11 sería votado durante la mañana para su aprobación. Ante las diversas consultas, el propio diputado Gabriel Boric usó su cuenta de Twitter para aclararlo. ""Ya se votó en la Cámara y todos los diputados Frente Amplio votamos en contra. Se aprobó sin nuestros votos. Falta la sala del Senado pero no tiene fecha aun de votación"", dijo el parlamentario, quien además hizo un llamado a que cuando llegue el día, se rechace.","(empty)","https://www.instagram.com/p/B4L0DNPDNsF/","photo","1,543,257","biobiochile"
"512",2,"Oct 28, 2019 @ 16:43:58.000","Meganoticias","30,607","29,715","892","🔴 Confusión en redes sociales ha provocado una noticia falsa que sostiene que el pasaje del Metro de Santiago habría aumentado en el horario bajo. Sin embargo, la información fue descartada por el tren subterráneo, quienes además aprovecharon de aclarar cuáles son los valores actuales, los que puedes revisar en la gráfica. Por otro lado, desde el Ministerio de Transporte aseguraron que los letreros viralizados que señalan otros valores están siendo retirados y reemplazados en las estaciones.","(empty)","https://www.instagram.com/p/B4LI7VihAok/","photo","2,652,893","meganoticiascl"
"513",2,"Oct 28, 2019 @ 10:21:42.000","Cooperativa","5,147","4,977","170","""¿Por qué no hablan del TPP11?"". Otra noticia falsa se tomó las redes sociales y cadenas de WhatsApp durante las últimas horas y se usa para llamar a otra manifestación en las calles: La votación ""hoy"" del acuerdo Tratado Transpacífico, también conocido como TPP11.
El tratado fue aprobado por la Cámara y la comisión de Constitución del Senado, quedando pendiente su ratificación en la sala de la Cámara Alta. Pero este trámite aún no tiene fecha y no es efectivo que esté en tabla para este lunes 28 de octubre ""en el Congreso"".","(empty)","https://www.instagram.com/p/B4KdLjdAdB9/","photo","1,065,403","cooperativa"
"514",2,"Oct 25, 2019 @ 17:13:07.000","El Ciudadano","1,403","1,367","36","Así también condenamos la desinformación en que incurren los grandes medios de comunicación de masas que, al servicio de las grandes fortunas de este país, que tergiversan la información en virtud de criminalizar las movilizaciones sociales y las protestas del pueblo de Chile. #DeclaraciónPública 🇨🇱 #ElCiudadano #NoticiasQueImportan #LaMarchaMasGrandeDeChile","(empty)","https://www.instagram.com/p/B4Dd4J4gae8/","album","604,487","el.ciudadano"
"515",2,"Oct 24, 2019 @ 16:47:15.000","El Siglo","122","120","2","La Coordinadora por una Vida Digna y Justicia Social, convocó a las organizaciones sociales, sindicales, estudiantiles, barriales y a los chilenos y chilenas a realizar cabildos para conversar sobre la actual situación que atraviesa el país. . “Hoy como ayer, la derecha reaccionaria recurre a la militarización y reaparecen las violaciones a los derechos humanos, los mismos que conocimos bajo la dictadura: asesinatos, tortura, detenciones ilegales, represión masiva, amedrentamiento a los dirigentes sociales, desinformación, guerra psicológica para crear el pánico entre la gente. Hay bastante evidencia que muchos saqueos e incendios son provocados o estimulados por acción u omisión de las fuerzas policiales y militares”, señaló la organización en un comunicado.

Asimismo, la Mesa de Unidad Social que agrupa a decenas de agrupaciones sociales, desplegó la misma convocatoria a nivel nacional. La idea es que se hagan reuniones temáticas y de problemáticas generales.

La idea es sumar a todas las instancias ciudadanas a reunirse en los sindicatos, juntas de vecinos, centros culturales, clubes deportivos, con el fin de unificar todas las luchas para avanzar soluciones más profundas como un cambio constitucional.","(empty)","https://www.instagram.com/p/B4A2H4eJUXA/","photo","9,468","elsiglochile"
"516",3,"Oct 24, 2019 @ 12:18:45.000","Diarios En Red","13","13","0","El @ejercito_chile desmintió el llamado de acuartelamiento que fue difundido por redes sociales: “Se informa a la opinión pública que la imagen que se divulga en la Redes Sociales, respecto a un llamado de acuartelamiento de la reserva, carece de veracidad y ha sido catalogada como “fake news”.","(empty)","https://www.instagram.com/p/B4AXZVRJSIr/","photo","6,484","diariosenred"
"517",3,"Oct 24, 2019 @ 12:15:32.000","Red Maule - Diarios en Red","659","643","16","El @ejercito_chile desmintió el llamado de acuartelamiento que fue difundido por redes sociales: “Se informa a la opinión pública que la imagen que se divulga en la Redes Sociales, respecto a un llamado de acuartelamiento de la reserva, carece de veracidad y ha sido catalogada como “fake news”.","(empty)","https://www.instagram.com/p/B4AXBu7JVRy/","photo","87,884","redmaule"
"518",3,"Oct 24, 2019 @ 08:38:16.000","Diario Clave9","1","1","0","Promueven prácticas para reducir circulación de noticias falsas en contexto de emergencia https://buff.ly/2PeZ6RB","(empty)","https://www.instagram.com/p/B3_-KfAgeF7/","photo","3,817","clave9"
"519",2,"Oct 23, 2019 @ 12:10:57.000","Página 7","615","586","29","Un curioso registro se compartió por las redes sociales, donde se ve a un grupo de Carabineros en Plaza Italia, conversando con un encapuchado, quien sin problemas pudo conversar con ellos. De inmediato se aseguró que se trataba de un uniformado infiltrado. “Ante información falsa que circula en redes, precisamos que en Dr. Corvalán / Alameda, se acercó encapuchado a informar a Carabineros que se producía un incendio en un edificio cercano. Luego, los mismos sujetos despejaron la vía para que Bomberos accediera al lugar”, fue el mensaje que se difundió en la cuenta oficial de Carabineros en Twitter, para aclarar este particular encuentro. 
#Página7Chile #Página7 #Carabineros","(empty)","https://www.instagram.com/p/B39xruDg_gh/","video","109,886","pagina7chile"
