"","tipoI","Date","Account","totalInteractionCount","Likes","Comments","Description","ImageText","URL","Type","FollowersAtPosting","InstagramAccount"
"1",2,"Dec 31, 2021 @ 13:01:38.000","El Ciudadano","983","920","63","Otra fake news: Servel desmiente fraude electoral denunciado por adherentes de Kast en redes sociales

Lee nota completa en el link de las historias 👆","elciudadano.com OTRA FAKE NEWS: SERVEL DESMIENTE FRAUDE ELECTORAL DENUNCIADO POR ADHERENTES DE KAST EN REDES SOCIALES 平安 E 5 F 9250800","https://www.instagram.com/tv/CYJzVWJhA5z/","video","612,519","el.ciudadano"
"2",2,"Dec 31, 2021 @ 11:01:15.000","El Desconcierto","2,102","2,016","86","#Nacional 📍 | A través de redes sociales se difundió un video que denunciaba la supuesta duplicación de mesas en la segunda vuelta presidencial que dio como ganador a Gabriel Boric. Servel dio una contundente respuesta, señalando que se trataba de una fake news.

Encuentra todos los detalles en la nota del link en nuestra bio.

#InformaConectaConstruye","D «ES INFORMACIÓN FALSA>: SERVEL DESMIENTE DUPLICACIÓN DE MESAS EN SEGUNDA VUELTA","https://www.instagram.com/p/CYJlqyqNxTN/","photo","420,859","eldesconcierto"
"3",2,"Dec 30, 2021 @ 20:49:36.000","Página 7","133","119","14","A través de Twitter, el Servicio Electoral desmintió una información que circuló por redes sociales, donde un elaborado video, aunque sustentado en información falsa, acusa de la supuesta existencia de mesas duplicadas que habrían favorecido a Gabriel Boric en las pasadas elecciones.

Se trata de un registro que presenta una planilla Excel, donde al filtrar algunos datos se repiten ciertas mesas que -supuestamente- le habrían dado 694 mil votos más al abanderado de Apruebo Dignidad.

Tras el revuelo en redes sociales, el Servel salió a aclarar que “sobre el video que expresa la existencia de mesas duplicadas, declaramos que esta información es falsa”.

“En algunas comunas existen mesas con iguales números, pero que corresponden a distintas circunscripciones electorales y por lo mismo a distintos locales de votación”, puntualizan.

De hecho, quien realiza el video ejecuta una operación en la planilla para generar una “llave” que contiene el código de la comuna y el número de mesa, lo que lleva a la aparición de “llaves” duplicadas, lo que sería la supuesta prueba clave.

Revisa la explicación en detalle en el link de nuestra BIO.

#Servel #Fraude #Elecciones #Página7Chile","Página SER Servel aclaró video viral que acusa supuesto fraude en elección presidencial: ""Es información falsa""","https://www.instagram.com/p/CYIENJlrR1f/","photo","109,922","pagina7chile"
"4",2,"Dec 29, 2021 @ 18:40:06.000","El Ciudadano","1,529","1,495","34","La Mesa Directiva de la #ConvencionConstitucional comienza a despedirse de sus funciones. Hoy es la última sesión del Pleno del año #2021. A pesar de todos los bloqueos y #fake news, nuestros #constituyentes trabajan día a día por un #Chile nuevo. Gracias @ElisaLoncon @Jaime_Bassa

 #Seguimos #loncon #bassa","MAÑUM LAMGEN JAIME BASSA MUCHAS GRACIAS, สอรัน LAMNGEN PRESIDENTA!! elciudadano.com","https://www.instagram.com/p/CYFQle0Fy66/","photo","612,347","el.ciudadano"
"5",2,"Dec 26, 2021 @ 10:45:01.000","Resumen","1,719","1,664","55","#OPINIÓN | El guion que ha aplicado la #ultraderecha en España, Estados Unidos, Brasil, Hungría, Reino Unido y otros países, fracasó rotundamente en Chile y perdió por paliza. Un discurso coordinado internacionalmente de noticias falsas, fuerte antifeminismo, campaña del terror, fundamentalismo religioso, imputación de eventuales delitos al contrincante, ataques personales a figuras, entre otros, recibió una de sus zozobras más importantes a nivel mundial en la segunda vuelta chilena con la derrota de José Antonio Kast
.
Lee la columna de nuestro editor Alejandro Baeza, en Resumen.cl (LINK EN LA BIO)
.
#Chile #elecciones2021 #ForoMadrid #Kast #NuevaDerechaRadical #ExtremaDerecha #JoséAntonioKast #Resumen","(empty)","https://www.instagram.com/p/CX8r1fAtPIL/","album","80,829","resumen.cl"
"6",2,"Dec 21, 2021 @ 16:40:07.000","El Ciudadano","690","683","7","""(...) La ultraderecha autodefinidos como “patriotas”, creyó tener oportunidad de ganar en segunda vuelta a través de una campaña “sucia” del todo vale (...)""

🔴Leer nota: http://ow.ly/8WtJ50HgO2O

#Desbordes #chile #fakenews","EN PAUTA EL CIUDADANO El fracaso de la ultraderecha chilena con su manual Bannon y los fake news en la elección presidencial BANNON 2,000lb. Manual Chain Hoist Item # 57068 Convergencia Social Gabriel Boric 55,9% 55 4.620.671 votos Mayoria Republicanos José Antonio Kast 44 1% 3.649.647 votos elciudadano.com","https://www.instagram.com/p/CXwcfofu-9H/","photo","609,503","el.ciudadano"
"7",2,"Dec 21, 2021 @ 10:40:06.000","El Ciudadano","1,837","1,817","20","Gonzalo de la Carrera culpa al comando de Kast por imagen trucada y fake news que publicó sobre Gabriel Boric

🔴 Leer nota: http://ow.ly/YeQ350Hg9lr
#LasParedesHablan #NoMasFascismo","(empty)","https://www.instagram.com/p/CXvzS4Wgd5Q/","photo","609,503","el.ciudadano"
"8",2,"Dec 20, 2021 @ 23:07:57.000","El Ciudadano","26,913","26,675","238","El fracaso de la ultraderecha chilena con su manual Bannon y los fake news en la elección presidencial

🔴 Leer nota: ow.ly/melP50Hg6xo
vía @viirshit 
#BoricPresidente #BoricPresidente2022 #Elecciones2021CL","(empty)","https://www.instagram.com/p/CXukFqbtQ4C/","album","609,503","el.ciudadano"
"9",2,"Dec 20, 2021 @ 21:06:35.000","CHV Noticias","2,842","2,634","208","En el programa Contigo la Mañana de Chilevisión, el diputado electo del Partido Republicano, Gonzalo De La Carrera, se refirió a la fake news que difundió hace un tiempo, donde se mostraba una foto trucada de Gabriel Boric.

Sin embargo, ese no sería el único caso, ya que, luego del último debate presidencial, le pidieron escribir un twit respecto al examen de orina. “Yo les dije que han pasado solamente 20 minutos del debate y nadie sabe si esto es fake o real. No me voy a comer otro fake”.

Lee más detalles en el link de la bio👆","DE LA CARRERA DIJO QUE LE PIDIERON DIFUNDIR UNA FAKE NEWS cHи NOTICIAS","https://www.instagram.com/p/CXuWMuPLiSq/","photo","562,2","chvnoticias"
"10",2,"Dec 20, 2021 @ 12:23:09.000","La Red TV Chile","4,515","4,231","284","Luego de transformarse en uno de los principales liderazgos de la derecha y forzar el apoyo del oficialismo en esta segunda vuelta, José Antonio Kast culmina su carrera presidencial con una contundente derrota a manos de Gabriel Boric. Su campaña situada al extremo del conservadurismo y basada en el miedo y las fake news terminó condenándolo al movilizar en masa a a millones de votantes que rechazaron su ascenso a la presidencia.","E LARED.CL ile.cl LA CAMPAÑA DEL TERROR Y LAS MALAS COMPAÃÍAS QUE HUNDIERON A KAST EN SU CAMINO A LA MONEDA RED","https://www.instagram.com/p/CXtaTC0OXrj/","photo","120,198","laredtv"
"11",2,"Dec 19, 2021 @ 18:39:30.000","Diario El Mostrador","2,169","2,104","65","Desde el Gobierno se han escudado en que la planificación está dentro de lo normal y han acusado a la oposición de instalar ""fake news"" e incluso de hacer ""acarreo"" al disponer transporte municipal para llevar a los electores de los locales de votación. Al ruedo ha entrado incluso el jefe de asesores del Segundo Piso de La Moneda, Cristián Larroulet. 

El personero de Gobierno retuiteó un mensaje del subsecretario del Interior, Juan Francisco Galli, quien reprochó a Izkia Siches, generalísima del comando del abanderado de Apruebo Dignidad, Gabriel Boric, la que acusó la operación política del Gobierno al ""limitar transporte público en favor de su candidato"". 

Esta tarde, incluso, se presentó una querella con la ministra de Transportes, Gloria Hutt, por negación de servicio. Al filo de la cierre de las mesas, sin embargo, los problemas persisten en Rancagua Quilpué, Los Andes, Cabildo, Villa Alemana, Panquehue, La Ligua, Rinconada, Limache, Nogales, Valparaíso, Viña del Mar y varias comunas de la RM. 

Todo ello al ritmo que se multiplican las fotografías de terminales de microbuses llenos de máquinas estacionadas. ""Nos parece escandaloso que una persona no pueda emitir su voto por no tener transporte"",sostuvo el coordinador político del comando de Gabriel Boric, Giorgio Jackson.

👉Continúa leyendo en el link de la bio❗","elm Gobierno contra la pared: persiste el problema del transporte mientras se caldean los ánimos en RM y regiones","https://www.instagram.com/p/CXrgkl8uPtd/","photo","454,19","el_mostrador"
"12",2,"Dec 19, 2021 @ 16:01:40.000","Agricultura","1,851","1,589","262","Polémica causaron las declaraciones de la jefa de campaña de Gabriel Boric, Izkia Siches, quien a través de su cuenta de Twitter tachó de “operación política” la falta de buses este domingo durante la jornada electoral.⁠
⁠
Ante esto, el Subsecretario del Interior, Juan Francisco Galli tuvo una tajante respuesta: “Esta es la definición de Fake News, alguien creíble esparciendo una mentira sin fundamento"", escribió en la misma red social.⁠
⁠
""Hágase cargo de sus palabras para lo que pueda ocurrir por incitar al odio y división"", añadió Galli. ⁠
⁠
🔺Más detalles en Agricultura.cl (link en bio)","a: a: ELECCIONES 2021 "" SUBSECRETARIO GALLI ACUSA A IZKIA SICHES DE LANZAR ""FAKE NEWS"": ""HÁGASE CARGO DE SUS PALABRAS""","https://www.instagram.com/p/CXrOd8_OmX3/","photo","67,718","radioagricultura"
"13",2,"Dec 17, 2021 @ 18:00:40.000","Radio Duna","76","72","4","Jair Bolsonaro, presidente de Brasil, fue identificado como el principal responsable del uso de noticias falsas para atacar instituciones democráticas en las elecciones de 2018, según la Policía Federal de ese país.

“Esta investigación nos ha permitido identificar el rol directo y relevante de Bolsonaro en la desinformación (durante las elecciones), unido a su adhesión al procedimiento ‘estándar’ de actuación empleado por miembros de gobiernos de otros países”, manifestó la portavoz de la policía brasileña, Denisse Ribeiro, según recoge La Tercera.

En esta investigación policial se destaca que “la vida presidencial se realizó con el claro propósito de desinformar y llevar a la población al error en cuanto a la equidad del sistema de votación”

¿Qué te parece? Encuentra más detalles en el link de nuestra bio.
.
.
.
#Bolsonaro #FakeNews #Brasil","DUNA.CL Bolsonaro, vocero de las fake news en Brasil: Policía concluye que tuvo una participación directa en la difusión de noticias falsas","https://www.instagram.com/p/CXmSif6vtSS/","photo","16,332","radioduna"
"14",2,"Dec 17, 2021 @ 12:14:09.000","Diario El Mostrador","46","43","3","Hugo Herrera y el test de drogas: “Kast se equivoca, quiere montar la imagen de un jovencito medio frivolón que se droga y, cuando se vuelve majadero el asunto, pierde eficacia”

El analista político y académico de la UDP considera que en el sector de #Kast “hay gente bien inquietante”, como Johannes Kaiser y Gonzalo de la Carrera, este último recurrente interlocutor de fake news. Sin embargo, Herrera descartó que Kast sea fascista, y dijo que “puede ser alguien extremo o de derecha dura"", al tiempo que desestimó que repita liderazgos como el de #JairBolsonaro o #DonaldTrump. Sobre la centroderecha, afirmó que ""si gana Kast, sin duda que el ámbito de existencia de esa centroderecha va a ser difícil, como lo ha sido con Piñera por lo demás. Si sale Boric es un poco más fácil, porque queda un poco más claro quién es el adversario"".","KAPWING","https://www.instagram.com/tv/CXlqqq7NkOu/","video","453,851","el_mostrador"
"15",2,"Dec 17, 2021 @ 10:55:29.000","The Clinic","1,112","1,007","105","#Presidenciales2021 🗳 | Como si no se hubiera muerto Lucía Hiriart, los adherentes de José Antonio Kast bailaban al son de Apretaito, sin atender nunca que había muerto la viuda del dictador Augusto Pinochet. Una coincidencia que resuena en la fibra íntima en sectores de sus adherentes, pero que públicamente pasó inadvertido cuando ayer, 16 de Diciembre, atardecía en el Parque Araucano, corazón de la comuna de Las Condes, en medio de banderas chilenas, otras azules y blancas con el apellido del abanderado, y hasta una que rezaba “Cubanos por Kast”.

👉 Lee la nota completa en el link de nuestra bio 📲.

#cierredecampaña #kast #elecciones2021 #politica #segundavuelta 
https://bit.ly/3yBmpth","#Presidenciales2021 Comunismo. fake news y Estado de Derecho: el cierre de campaña de Kast con afilada artillería contra Boric la izquierda Horas de rancheras una breve participación de modelo Daniella Chávez, expusado demócratacristiano que llegó en un curioso tren verde con oanderas de la Falange,y entusiasta participación de su extensa familia en la actividad. ATIVETE VETE EE T× DECHILE THECLINIC THE","https://www.instagram.com/p/CXlh4ThtSaV/","photo","546,602","theclinic_cl"
"16",2,"Dec 17, 2021 @ 09:13:06.000","EL DÍNAMO","507","334","173","José Antonio Kast, candidato presidencial republicano, concretó el cierre de su campaña con un acto en el Parque Araucano.

Kast dijo que “Chile no será jamás un país marxista y comunista”, junto con responder a las acusaciones de fake news por parte de Boric, apuntando que “no es una mala persona, pero tiene malas ideas y mala compañía. Ha querido cambiar su imagen, usted es la falsedad, usted le ha querido mentir a los chilenos (…) La noticia falsa es usted, señor Boric. Nosotros hablamos con la verdad. Lo que hemos visto en estas dos semanas me da vergüenza”.

📲 Sigue leyendo en el link de la bio.","ELDÍNAMO VERDADES QUE QUE MUEVEN José Antonio Kast: ""Chile no será jamás un país marxista y comunista""","https://www.instagram.com/p/CXlWKbCh7-C/","photo","64,086","el_dinamo"
"17",2,"Dec 17, 2021 @ 08:01:33.000","Diario El Mostrador","35","34","1","La abogada y primera chilena en presidir la @cidh_iachr se refiere a los principales desafíos regionales en la materia, entre los que destacó el aumento de la violencia de género y la desigualdad estructural en el continente, particularmente en contexto de pandemia. ""Una de las preocupaciones que hemos tenido desde la Comisión es la violencia física y sexual contra mujeres, niñas y adolescentes. (...) La Cepal habla que durante el año pasado hubo 4 mil mujeres en América Latina víctimas de feminicidio. Esa cifra es inaceptable en estos tiempos, y es un tema que tiene que ver con falta de políticas públicas y en algunos países con un tema cultural"", señala. Otro foco de atención es la grave situación política en Nicaragua, donde –en su opinión– no existe Estado de derecho, por lo que no es posible resguardar los derechos humanos en el país. ""El Gobierno nicaragüense no es de izquierda o de derecha, es un Estado dictatorial que está en manos de un matrimonio que no tiene un proyecto social. Toda disidencia está hostigada, en el exilio, o detenida ilegalmente. La Comisión ha hecho diversos informes para llamar la atención de los organismos internacionales"", indica. A propósito de las expresiones populistas en la región, advierte sobre el peligro que tienen los discursos de odio y de intolerancia, los cuales han contribuido al deterioro del espacio público, donde las redes sociales se utilizan para estigmatizar al otro y difundir noticias falsas. Situación que –a su juicio– ""genera un conjunto de consecuencias respecto a las violaciones de los DD.HH., por lo que es muy peligroso lo que estamos viendo en el continente"".","(empty)","https://www.instagram.com/tv/CXlNzSQsFC3/","video","453,851","el_mostrador"
"18",2,"Dec 17, 2021 @ 01:30:01.000","CNNChile","10,383","8,017","2,366","Llegado el cierre de las campañas electorales de ambos candidatos de cara a la segunda vuelta presidencia, el abanderado de Frente Social Cristiano se reunió con sus adherentes en el Parque Araucano en Las Condes.

Durante el evento, Kast realizó su último discurso donde criticó duramente al parlamentario de Frente Amplio, recalcando las acciones que ha realizado en el pasado.

“Quiero hacer una reflexión, Gabriel Boric no es una mala persona, pero tiene malas ideas y tiene mala compañía. Ha querido cambiar su imagen, pero es el mismo que quería indultar a los vándalos que destruyeron Chile, es el mismo que no quería sancionar a los que agraden a bomberos y el mismo que se juntó con un asesino terrorista que asesinó a Jaime Guzmán”, aseguró.",""" Aquí no hay noticias falsas, senor Boric usted es la falsedad' CNN CHILE José Antonio Kast en su cierre de campaña","https://www.instagram.com/p/CXkhKq3IU8g/","photo","845,911","cnnchile"
"19",2,"Dec 17, 2021 @ 00:00:24.000","CHV Noticias","6,173","5,02","1,153","Durante su cierre de campaña, el candidato del Frente Social Cristiano lanzó duras frases contra su contendor Gabriel #Boric, asegurando que “no es una mala persona, pero tiene malas ideas y compañía”.

#Kast, además, hizo un guiño a los militantes de la DC que le han manifestado su apoyo y ""se atrevieron a levantar la voz”.

Revisa más detalles en CHVNoticias.cl, disponible en el link de nuestra bio 👆",""" Aquí no hay noticias falsas señor Boric, usted es la falsedad"" cI NOTICIAS José Antonio Kast lanzó duro mensaje en cierre de campaña","https://www.instagram.com/p/CXkW6V1NMb3/","photo","560,578","chvnoticias"
"20",2,"Dec 16, 2021 @ 22:25:48.000","Diario El Mostrador","2,261","1,959","302","El candidato presidencial de Apruebo Dignidad, @gabrielboric, y el del Frente Social Cristiano, @joseantoniokast cerraron este jueves sus campañas presidenciales de cara al balotaje de este domingo 19 de diciembre. 

El primero en aparecer en escena fue el abanderado de izquierda, quien desde el Parque Almagro dijo que ""cuando nos unimos somos mucho más fuertes (…) nos unimos para derrotar a la dictadura, nos unimos para tener una nueva Constitución y hoy nos unimos para derrotar al heredero de este gobierno y del pinochestismo”. 

Horas más tarde, fue el turno de Kast, quien fue precedido por un discurso de su hija, Josefina. Kast apuntó directamente contra el candidato opositor: ""Boric no es una mala persona, pero tiene malas ideas y tiene mala compañía. Usted es la falsedad señor Boric, la noticia falsa es usted señor Boric. Nosotros hablamos con la verdad. Lo que hemos visto en estas dos semanas me da vergüenza"".

👉Continúa leyendo en el link de la bio❗","elme Con masivas convocatorias, Gabriel Boric yJosé Antonio Kast cıerran sus campañas de cara a la segunda vuelta","https://www.instagram.com/p/CXkMFebNreB/","photo","453,851","el_mostrador"
"21",2,"Dec 16, 2021 @ 14:12:05.000","El Ciudadano","1,324","1,259","65","Giorgio Jackson hace llamado a no creer en campaña sucia con noticias falsas del candidato de ultra derecha.
#NoALaCampañaSucia #BoricPresidente","(empty)","https://www.instagram.com/tv/CXjTOoKJFEo/","video","604,487","el.ciudadano"
"22",2,"Dec 16, 2021 @ 12:28:23.000","Diario El Mostrador","5,331","4,989","342","La idea de llevar el resultado final al Tribunal Electoral comienza a cobrar fuerza en la derecha -sin deslizar la posibilidad de fraude- como adelantó el presidente de @rnchile, @pancho_chahuan, quien indicó que esta elección va a ser estrecha. “Cuando yo hablo de estrecha, quiero decir que esto puede que no se resuelva el domingo"". Ante esta posibilidad, el candidato del #FrenteSocialCristiano, @joseantoniokast apoyó la inicitiva al señalar que “en muchos casos las elecciones se han definido a nivel distrital y a otras instancias en nuestros tribunales electorales"". Este tipo de anuncios previo a la elección, según coinciden analistas y el propio candidato de #AprueboDignodad @gabrielboric, se enmarcan dentro del denominado libreto trumpista, que busca instalar la incertidumbre sobre los fiabilidad de los resultados antes de la elecciones. “Es de manual lo que está haciendo la ultraderecha en Chile, ustedes lo ven: es exactamente lo mismo que (Donald) Trump. Están empezando a cuestionar los eventuales resultados”. En conversación con #ElMostradorenLaClave, el presidente del Servicio Electoral @servel.chile), Andrés Tagle, descartó cualquier posibilidad de fraude en las elecciones de este domingo. ""Han habido hartas noticias falsas en redes sociales, hablan de un fraude del Servel. Esto es básicamente un desconocimiento de nuestra legislación sobre el tema de escrutinio"", dijo.

👉continúa leyendo en el link de la bio❗","elmo Û recha de recurrir al Idea de la Tribunal Elec ctoral si los resultados son estrechos enciende los ánimos en la oposicióny denuncian intento de calcar el ""Manual Trump""","https://www.instagram.com/p/CXjHt3rNh6x/","photo","453,71","el_mostrador"
"23",2,"Dec 15, 2021 @ 22:00:41.000","Diario El Mostrador","4,561","4,355","206","Con el hashtag #CuidadoConPinocho, el segmento de @gabrielboric  indica que ""hay campañas tan caras de palo, que son capaces de echar a correr la mentira que sea con tal de ganar"", aludiendo a las #fakenews que han difundido adherentes de @joseantoniokast. 

Por su parte, el candidato del Frente Social Cristiano ocupó el espacio para dirigirse a los adultos mayores.

👉continúa leyendo en el link de la bio ❗","elmo Compare noticias falsas, las twittean, Franja electoral: segmento de Boric alude a fake news y ""campañas hechas por Pinocho"", mientras Kast se dirige a los adultos mayores","https://www.instagram.com/p/CXhkar4Nxf-/","photo","453,71","el_mostrador"
"24",3,"Dec 15, 2021 @ 15:58:30.000","El Diario De Antofagasta","236","225","11","#MunicipioVsGobierno | Mediante videos en redes como Facebook y Tiktok, tanto el Alcalde como el ente gubernamental han expresado sus puntos de vista contrapuestos respecto a la recepción de Playa La Chimba, enfrentamiento que sigue sin solución y ahora suma otro capítulo.

Los detalles en DiarioAntofagasta.cl #NoticiasDeVerdad ✅","El Diario DeAntofagasta Noticias de Verdad ANTOFAGASTA Municipio de Antofagasta y Gobierno se enfrentan mediante Facebook y Tiktok: Alcalde criticó ""apitutados""y el MOP lo acusa de difundir ""fake news"" sobre playa artificial La Chimba","https://www.instagram.com/p/CXg69_iFChM/","photo","24,201","diarioafta"
"25",2,"Dec 15, 2021 @ 11:35:37.000","The Clinic","468","443","25","#CosechaPropia 📍 | Si en algo están de acuerdo los cuatro expertos contactados por The Clinic, es que el fenómeno de las fake news y desinformación en Chile está en uno de sus puntos más álgidos. El panorama electoral político actual y el protagonismo de las redes sociales han generado un escenario idóneo para el esparcimiento de este tipo de material, el cual -aseguran- llegó para quedarse. 

👉 Lee el artículo completo en el link de nuestra bio 📲.

#fakenews #factcheck #campañapolitica #elecciones2021 #presidenciales #segundavuelta 
https://bit.ly/3sa3wwu","(empty)","https://www.instagram.com/p/CXgc4d7ISki/","album","546,238","theclinic_cl"
"26",2,"Dec 15, 2021 @ 08:25:57.000","Diario El Mostrador","52","36","16","Francisco Chahuán y la gobernabilidad de Chile Vamos: “Nosotros no vamos a incorporar en nuestra coalición de gobierno a Republicanos”

“#ChileVamos va a ser garantía de moderación, 24 senadores y 53 diputados”. Esta es la respuesta del presidente de @rnchile, @pancho_chahuan, al ser consultado por la convivencia futura en el sector con los representantes del @p_republicano, del candidato presidencial @joseantoniokast, donde hay varios que han hecho fama por expandir fake news. En esta línea, y respecto a cómo se entiende que una colectividad como RN –con representantes del socialcristianismo y que lleva años buscando transformar a la derecha en una moderada y moderna– pasara de un día a otro a relacionarse con exponentes del mundo ultraconservador y de la ultraderecha, Chahuán explica que “en una elección binaria (como este balotaje), uno tiene que optar por dos proyectos de país, y reconocer que ninguno de esos dos proyectos era parte de lo que nosotros adscribíamos en primera vuelta”. En relación con el apoyo público que la ex Presidenta #MichelleBachelet le entregó a @gabrielboric, y a diferencia de diputados de su partido que anunciaron el envío de una carta a la #ONU, el senador por la Región de Valparaíso siguió el guión del Gobierno y se limitó a decir que “no es casualidad que su fundación hubiese manifestado apoyo explícito a la candidatura de Boric, y que ella también lo haga en particular”.","(empty)","https://www.instagram.com/tv/CXgG0i4gRBf/","video","453,584","el_mostrador"
