"","tipoI","Date","Account","totalInteractionCount","Likes","Comments","Description","ImageText","URL","Type","FollowersAtPosting","InstagramAccount"
"335",2,"Sep 1, 2020 @ 11:46:59.000","Publimetro Chile","822","582","240","""Los camioneros somos gente de trabajo, no somos lo que se muestra en ese video. Puede ser un video falso"", expresó José Villagrán.

El presidente de la Federación de Dueños de Camiones del Sur (Fedesur), José Villagrán, se refirió este martes al polémico video en que se ve a un grupo de camioneros bailando en la calle con mujeres en ropa interior.

En entrevista con CHV Noticias, el dirigente señaló que los hombres que aparecen en el registro serían de una asociación gremial del norte y que esta no sería parte de la Confederación Nacional de Transporte de Carga de Chile (CNTC).

Villagrán afirmó además que no tenía certeza de la veracidad del registro, señalando que ""la verdad es que me quedó la duda porque los camioneros no somos así, no hacemos eso, puede ser hasta una noticia falsa"".

""Estamos haciendo las averiguaciones correspondientes y, si fuera así, nosotros le vamos a pedir a su presidente que tome las medidas que corresponden porque una cosa así hay que sancionarla. Los camioneros somos gente de trabajo, no somos lo que se muestra en ese video. Puede ser un video falso"", manifestó.

👉 Lee la nota completa en el link de nuestra bio.
.
.
.
bit.ly/3bsP7Bn","PRESIDENTEDEFEDESURY POLÉMICO VIDEO DEFIESTA: ""LOS CAMIONEROS NOSOMOS ASÍ, NOHACEMOS ESO"" publimetro","https://www.instagram.com/p/CEmXb_-g1O2/","photo","344,376","publimetrochile"
"336",2,"Sep 1, 2020 @ 11:25:02.000","La Cuarta","754","601","153","El presidente de la Federación de Dueños de Camiones del Sur (Fedesur), José Villagrán, se refirió al polémico video en el que un grupo de camioneros baila en la vía pública junto a dos mujeres en ropa interior.

Según el dirigente, los protagonistas del registro pertenecerían a una asociación gremial del norte del país y que no forma parte de la Confederación Nacional de Transporte de Carga de Chile (CNTC).

«La verdad es que me quedó la duda porque los camioneros no somos así, no hacemos eso, puede ser hasta una noticia falsa», aseguró Villangrán, en diálogo con CHV Noticias.","(empty)","https://www.instagram.com/p/CEmU7QPgzrj/","photo","399,776","lacuartacom"
"337",3,"Aug 27, 2020 @ 12:53:33.000","El Rancahuaso","16","16","0","""El coronavirus es mentira"": El ataque de las fake news en pandemia.

Nuestro corresponsal, Bastián Salfate, da de qué hablar con un tema que ha generado un gran impacto estos últimos años: las fake news o noticias falsas. Con esto, el periodista, nos detalla lo que es este fenómeno a través de situaciones actuales, ejemplos, definiciones. Para las redes sociales, una grave situación. ¿Para el #BienComún también?

Link en el Bio👈🏼📰

#MiVoz #Ohiggins #Chile","(empty)","https://www.instagram.com/p/CEZnFGvBeMo/","photo","566","elrancahuaso.cl"
"338",2,"Aug 27, 2020 @ 12:21:50.000","El Ciudadano","9,53","9,274","256","Un día como hoy, en 1982, juez Luis Correa Bulo decretó orden de arresto  contra el gerente del Banco de Talca Sebastián Piñera. Este se mantuvo prófugo de la justicia hasta que sus contactos con el régimen de Pinochet le posibilitaron librarse del brazo de la Ley...
#FueraPiñera #apruebo #PreguntasAlHuesoMG #chiledespertó","(empty)","https://www.instagram.com/p/CEZjcgsnPF5/","photo","604,071","el.ciudadano"
"339",2,"Aug 25, 2020 @ 13:00:47.000","LUN","65","63","2","Una de las fake news que circula por las redes ha provocado 800 muertes y 5.876 hospitalizaciones 😰
Estudio comprobó que varias falacias sobre el Covid producen incluso víctimas fatales, así que mucho cuidado con lo que cree. 
https://bit.ly/3hsqt5L","(empty)","https://www.instagram.com/p/CEUeUD5HGgW/","photo","431,962","lungram"
"340",2,"Aug 25, 2020 @ 12:30:19.000","LUN","54","53","1","Fake news: 55 grandes mentiras sobre el Covid-19. 
Investigadores analizaron los rumores y bulos más esparcidos en 87 países, incluido Chile. Mire cuáles son, para que usted no caiga 👇
https://bit.ly/34pM2QW","(empty)","https://www.instagram.com/p/CEUa06QlvGG/","photo","431,962","lungram"
"341",3,"Aug 24, 2020 @ 10:05:39.000","Diario Concepción","268","254","14","Covid-19 en el Gran Concepción: autoridades advierten posibilidad de llegar a fase 1. Intendente, Sergio Giacaman, pidió a la ciudadanía colaboración tras una jornada con más de 250 detenidos y llamó a “los ociosos” a terminar con las fake news que circulan en redes sociales

Lee la nota completa en www.diarioconcepcion.cl

#covid19 #coronavirus #salud","(empty)","https://www.instagram.com/p/CERlekllp7E/","photo","60,901","diarioconcepcion"
"342",2,"Aug 23, 2020 @ 11:34:28.000","The Clinic","464","459","5","#Series La consulta de Pekeka: Carlitos está asustado 🔶 Carlitos no quiere salir de su pieza y la tiene convertida en un búnker. Dice que tiene ramitas y bebidas para sobrevivir un año.
Hoy se levantó con miedo porque un amigo le dijo que afuera, el virus está en todos lados y que ha mutado y se ha convertido en un monstruo de tres metros de alto.
👧🧒  Pekeka le explica que hay mucha información falsa sobre el virus y le aconseja que si tiene dudas, siempre acuda a fuentes confiables o a sus papás o profesores.
👉 Revisa el ciclo completo en el link de nuestra bio 📲, y en nuestras historias destacadas ""Consulta Pekeka"".
#niños #picologia #saludmental #salud #niñas #pandemia #animacion #instagram #niñosfelices #niñosencasa #chilegram #chile #TheClinic
https://bit.ly/3aOEqsa","(empty)","https://www.instagram.com/p/CEPK2YIpFYr/","photo","546,238","theclinic_cl"
"343",2,"Aug 21, 2020 @ 18:52:49.000","Cooperativa","199","196","3","Noticias falsas, la otra pandemia, será uno de los temas de este domingo en Congreso Futuro ¦ Presentan @congresofuturo y @enelchile","(empty)","https://www.instagram.com/p/CEKzbSPgcx6/","photo","1,065,292","cooperativa"
"344",2,"Aug 19, 2020 @ 22:00:45.000","Tele13Radio","14","14","0","En un nuevo capítulo de #BigData, Kike Mujica (@kikemujicatv) nos presenta un artículo del MIT Technology Review que habla sobre cómo la pandemia ha incrementado las noticias falsas. En Facebook, este tipo de páginas ha recibido casi cuatro veces más consultas que los sitios de fuentes confiables. 

Las páginas que difunden información errónea sobre salud obtuvieron un estimado de 3.800 millones de visitas en Facebook hasta mayo de este año, según un análisis del grupo de derechos humanos Avaaz. Las vistas alcanzaron un máximo de aproximadamente 500 millones solo en abril del 2020, justo cuando la pandemia estaba aumentando rápidamente a nivel mundial. 

Un estudio de American Journal of Tropical Medicine and Hygiene encontró que en todo el mundo, al menos 800 personas pueden haber muerto y otras 5.800 ingresaron a un hospital como resultado de información errónea sobre el coronavirus en los primeros tres meses de 2020. 

Para revisar el articulo completo, ingresa a: https://bit.ly/2EfTGCu 

#ContenidoEsencial en tele13radio.cl","(empty)","https://www.instagram.com/tv/CEF_TDNhdYz/","video","144,21","tele13_radio"
"345",2,"Aug 19, 2020 @ 15:08:55.000","Radio Duna","15","15","0","Un estudio publicado en el American Journal of Tropical Medicine and Hygiene analizó las noticias falsas a nivel mundial que han surgido en torno al coronavirus y cómo esto ha afectado a las personas.

La investigación abarcó rumores, estigmas y teorías de conspiración en redes sociales, diarios online y sitios web entre el 31 de diciembre de 2019 y el 5 de abril de este año.

“A raíz de esta desinformación, aproximadamente 800 personas han muerto en todo el mundo, mientras que 5.876 han sido hospitalizadas y 60 han desarrollado ceguera total después de beber metanol como cura para el coronavirus”, sostienen los autores del estudio.

Más información en duna.cl
.
.
.
#fakenews #noticiasfalsas #covid19 #coronavirus","(empty)","https://www.instagram.com/p/CEFQNlZno3P/","photo","16,302","radioduna"
"346",2,"Aug 18, 2020 @ 17:44:26.000","Página 7","885","880","5","Depresión, ansiedad, estrés: la pandemia de COVID-19 causó una “crisis de salud mental” sin precedentes en todo el continente americano, y llevó a un “alza de la violencia doméstica”, alertó el martes la Organización Panamericana de la Salud (OPS).

Desde mediados de marzo, cuando el coronavirus irrumpió en la región, muchos han sentido miedo a contagiarse, dolor por la pérdida de seres queridos, incertidumbre sobre el futuro, agobio por las noticias y la desinformación, soledad por aislamiento y el distanciamiento social.

“La pandemia de COVID-19 ha provocado una crisis de salud mental en nuestra región a una escala que nunca antes habíamos visto”, dijo en rueda de prensa virtual Carissa Etienne, directora de la OPS, oficina regional de la Organización Mundial de la Salud (OMS).

Esto ha incrementado el consumo de drogas y alcohol, lo cual “puede exacerbar los problemas de salud mental”, advirtió Etienne.

Además, las medidas para frenar los contagios, sumadas a los impactos sociales y económicos del virus, “están aumentando los riesgos de violencia doméstica”.

“El hogar no es un lugar seguro para muchos”, subrayó, al señalar una multiplicación de los pedidos de ayuda por abusos en Argentina, Colombia, y México.

Más información en el link de nuestra BIO.","(empty)","https://www.instagram.com/p/CEC9NyunbIK/","photo","109,879","pagina7chile"
"347",2,"Aug 15, 2020 @ 11:12:26.000","Meganoticias","64,467","63,605","862","NO, #Anabelle no se perdió 🙄🙄 De acuerdo al diario Globo de Brasil, este rumor, o noticia falsa mejor dicho, comenzó a esparcirse luego de que #WarnerBros. lanzara un video con la ""actualidad"" de la muñeca (la utilizada en las películas, no la que sale en la imagen arriba) en los estudios de grabación. En los registros se puede ver cómo se aburre en este periodo donde siguen al alza los contagios por #coronavirus y finalmente ""se va"" en un carrito de golf portando una mascarilla. Por lo anterior todos creyeron que se escapó, sin embargo, esto es falso. Así también lo hicieron saber desde el museo donde actualmente, sigue estando recluida la muñeca. Así que puedes guardar el agua bendita, crucifijos, o tus talismanes para cuidarte de la maldición del juguete de trapo 😰💀","(empty)","https://www.instagram.com/p/CD6h-HBgX0o/","photo","2,651,721","meganoticiascl"
"348",2,"Aug 15, 2020 @ 08:36:00.000","Diario El Mostrador","184","181","3","La presidenta de la Fundación Chile 21 dijo que, en el marco del plebiscito del 25 de octubre, es clave que el Gobierno y el Servel entreguen información clara y a tiempo en beneficio de la ciudadanía, precisamente para contrarrestar efectos negativos que generan las fake news en tiempos de campañas electorales, De la Fuente advirtió que, tal como en otros países, las fake news pueden ""afectar claramente los resultados o las maneras en que se aproximan o no a los días de las elecciones (…), porque eso genera cambios en las creencias y comportamientos en los electores, moviliza o desmoviliza, en base a información que es falsa”. La analista agregó que iniciativas como tratar de encauzar la discusión constitucional solo a través de reformas “no se sostiene de cara a lo que hemos visto a través de la pandemia, porque el nivel de vulnerabilidad que enfrenta la ciudadanía es tan grande, que esto nos va a obligar a repensar el Estado (…) y eso no es una reforma nomás, eso es un cambio de paradigma, saltar a un modelo más socialdemócrata, Ese debate solo se puede dar al calor de un proceso constituyente"".
👉ve la entrevista en el link de la bio❗️#plebiscito #25octubre #servel","(empty)","https://www.instagram.com/p/CD6QESsJ0nt/","photo","453,584","el_mostrador"
"349",2,"Aug 14, 2020 @ 20:36:10.000","CNNChile","780","731","49","Un estudio analizó diferentes rumores relacionados al coronavirus, publicados entre el 31 de diciembre y el 5 de abril. Esta “desinformación” ha conducido a muertes, daños y perjuicios de cientos de personas.          
                                               
¿De qué se trata en específico?

Ingresa a @futuro360com para conocer todos los detalles.","(empty)","https://www.instagram.com/p/CD49sDTj62-/","photo","844,77","cnnchile"
"350",2,"Aug 14, 2020 @ 17:35:38.000","Página 7","551","526","25","Este viernes comenzó a circular el rumor en redes sociales de que la supuesta muñeca que inspiró la película ""Annabelle"", había desaparecido de la casa de Ed y Lorraine Warren. 

Pese a que varios medios cubrieron la noticia, ninguno contaba con alguna fuente verídica y por eso fue el mismo nieto de los Warren, Chris McKinnell, quien desmintió la información en su cuenta de Facebook.

“Dicen que Annabelle ‘escapó’ de su caja durante un intercambio de dinero extraño y ya no está en el museo. Eso no es cierto. La muñeca ha estado guardada de forma segura desde 1975. Solo se pone, ocasionalmente, en una caja de exhibición viajera para eventos especiales”, indicó McKinnell, quien también tiene un canal en YouTube (The Warren files) en el que habla sobre el trabajo de sus abuelos.

Revisa el porqué de esta 'fake news' en el link de nuestra BIO.","(empty)","https://www.instagram.com/p/CD4pBzyniKO/","photo","109,879","pagina7chile"
"351",2,"Aug 14, 2020 @ 11:48:45.000","La Cuarta","2,129","2,039","90","¿Cuándo se acaba el 2020? 😰😫

Durante las últimas horas se viralizó la información de que la muñeca Annabelle escapó del Museo del Ocultismo que tienen los Warren. 

El hecho se transformó en el tema más comentado del día. Sin embargo, todo tiene una explicación. Esto debido a que Warner Bros realizó un video de como la muñeca vive la cuarentena. Lo que provocó el fake news en redes sociales.","(empty)","https://www.instagram.com/p/CD4BVK8JBic/","photo","399,776","lacuartacom"
"352",2,"Aug 13, 2020 @ 17:33:07.000","T13","2,097","2,026","71","Un proyecto de ley destinado a regular y sancionar la publicación en Internet de mentiras, montajes y todo lo considerado como noticias falsas, específicamente si están destinados a influir en decisiones electorales, es el que presentaron los senadores Felipe Harboe PPD, Ximena Rincón DC y Kenneth Pugh. La iniciativa surge tras el escándalo de Cambridge Analytica, la compañía involucrada en el uso de datos personales y la difusión de hechos falsos durante la campaña presidencial de 2016 en Estados Unidos. Detalles en el link de la bio.","(empty)","https://www.instagram.com/p/CD2D8fahFIh/","photo","1,510,486","teletrece"
"353",3,"Aug 11, 2020 @ 12:09:50.000","Marco Antonio Juri Ceballos","3","3","0","Falsa noticia del regreso a Cuarentena genera revuelo en San Felipe
Usando logos de Diario El Trabajo crearon alarma pública
Todo un revuelo alarmista se generó la mañana de este lunes en San Felipe luego que en redes sociales por Internet empezara a circular una falsa noticia en la que supuestamente Diario El Trabajo informábamos en nuestra página oficial el regreso a la Cuarentena Obligatoria a partir del próximo jueves a las 22:00 horas, lo que causó decenas de llamadas a nuestras oficinas, así también a los celulares de nuestro equipo de reporteros.
Algunos concejales y demás autoridades de nuestra comuna también se confundieron por algunos minutos, pues son las mismas autoridades quienes se enteran primero del accionar del Ministerio de Salud en este sentido. Los demás periodistas de otros medios también llamaron para confirmar la noticia, así como muchos de nuestros lectores de todo el Valle de Aconcagua, pues la sola idea de ser sometidos a una segunda Cuarentena de seguro que pone a muchos vecinos a temblar.
La noticia es falsa. Ante tal alboroto fue el mismo director de Diario El Trabajo el licenciado en Comunicación Marco Antonio Juri, quien salió a terreno para desmentir esta Fake News: «La verdad es bastante molesto enfrentar este tipo de situaciones, pues al margen de distraernos de nuestras labores diarias para tener que desmentir lo que NO hemos publicado, constituye una pérdida de tiempo al margen de afectar nuestra credibilidad. Si hasta familiares me llamaron para preguntar si era cierto. Pero bueno, por algo lo hacen, saben que Diario El Trabajo es un medio de comunicación creíble, con una larga trayectoria, por lo que a la hora de buscar difundir una noticia falsa, lo hacen usando el nombre de medios de comunicación ya establecidos, conocidos y por sobre todo creíbles. Esperemos que esto no nos afecte, pero son situaciones que crean alarma pública y deberían ser perseguidos por las autoridades», dijo Juri.","(empty)","https://www.instagram.com/p/CDwVW79nG9d/","photo","2,678","diario_el_trabajo"
"354",2,"Aug 11, 2020 @ 10:25:50.000","La Cuarta","583","537","46","Todos los troleos se ganó por redes sociales el diputado de Renovación Nacional, Cristóbal Urruticoechea. Esto, luego de difundir una imagen falsa de la causa mapuche en La Araucanía.

El parlamentario difundió por Twitter una foto en donde aparecía una «trampa viernamita», atribuyéndola a la organización política mapuche de la Coordinadora de Comunidades en Conflicto Arauco-Malleco (CAM).

Por esta razón, el diputado será llevado a Comisión de Ética de la Cámara Baja. Fue la diputada del Frente Amplio, Claudia Mix, quien anunció el requerimiento en contra del representante de RN por la difusión de «Fake News». «Inaceptable la intención de aumentar la polarización en conflicto», soltó.
.
.

Publicación
➡️La publicación de Urruticoechea señalaba que esa «trampa vietnamita» estaba instalada en la casa de miembros de la CAM y que por esa acción hubo carabineros heridos. Sin embargo, luego de enterarse de su equivocación, borró el posteo.","(empty)","https://www.instagram.com/p/CDwJdMEgp0O/","photo","399,776","lacuartacom"
"355",2,"Aug 10, 2020 @ 20:41:28.000","Página 7","412","389","23","Producto del terrible crimen de la menor Ámbar Cornejo, homicidio por el que el único sospechoso es Hugo Bustamante, quien está siendo formalizado este lunes, han surgido una serie de ‘fake news’ en redes sociales vinculadas a condenados por delitos similares.

Una de ellas es la que involucra a Alvio Rivas Espinoza, quien el año 2000 fue condenado a 40 años de presidio por la violación y homicidio de una menor de edad de 4 años, y cuya historia apareció incluso en la temporada 10 de Mea Culpa.

Y fue a partir de un clip de este programa que se comenzó a viralizar la información de que Rivas Espinoza había salido de la cárcel en mayo pasado, como uno de los beneficiados de la ley de conmutación de penas que promulgó el presidente Sebastián Piñera en mayo de este año, la cual benefició a 1.700 personas privadas de libertad.

Incluso el arquero Claudio Bravo compartió la misma publicación y la Defensora de la Niñez, Patricia Muñoz, le contestó con un “sigue privado de libertad”. Dando cuenta así de que esto no se trataría más que de una noticia falsa.

Además, desde Gendarmería notificaron a CHV Noticias que Rivas Espinoza aun se encuentra cumpliendo su condena en la cárcel de Concepción.

Más información en el link de nuestra BIO.","(empty)","https://www.instagram.com/p/CDurHa8n7Xz/","photo","109,879","pagina7chile"
"356",2,"Aug 9, 2020 @ 08:35:14.000","El Ciudadano","487","474","13","En #Bolivia los ciudadanos movilizados contra la #dictaduraAñez NO bloquean la ayuda. NO caiga en las trampas de la desinformación. Aquí 👈 las pruebas. vídeos COB, Telesur y @KawsachunNews #chilegram","(empty)","https://www.instagram.com/tv/CDqzAohAadf/","video","604,071","el.ciudadano"
"357",2,"Aug 7, 2020 @ 13:00:21.000","Agricultura","143","134","9","El presidente de Estados Unidos, Donald #Trump, firmó una orden ejecutiva que prohíbe “cualquier” transacción con la empresa propietaria de la aplicación móvil #TikTok, #ByteDance, dentro de 45 días.

En concreto, la orden prohíbe “cualquier transacción por parte de cualquier persona, o con respecto a cualquier propiedad, sujeta a la jurisdicción de Estados Unidos con ByteDance o sus subsidiarias”, según el texto difundido.

A su juicio, la difusión en el país norteamericano “de aplicaciones móviles desarrolladas y propiedad de empresas de China sigue amenazada la seguridad nacional, la política exterior y la economía de Estados Unidos” y aludió específicamente a la amenaza que representa TikTok en particular.

Según explicó, TikTok capta automáticamente “grandes cantidades de información” de sus usuarios, incluida información sobre internet y otras actividades de la red, como datos de localización y de navegación e historiales de búsqueda.

Así, “esta recopilación de datos amenaza con permitir al #PartidoComunista de #China (#PCCh) el acceso a información personal y de propiedad de los #estadounidenses” algo que permitiría de forma potencial “rastrear las ubicaciones de los empleados y contratistas federales, construir expedientes de información personal para el chantaje y realizar espionaje corporativo”. “Los riesgos son reales”, recalcó Trump.

Además, criticó que la aplicación “censura” contenidos que el PCCh considera “políticamente sensibles”, como los relativos a las protestas de Hong Kong o el tratamiento del Ejecutivo chino a los uigures y otras minorías musulmanas. “Puede utilizarse para campañas de desinformación que beneficien al PCCh”, señaló.","TRUMP FIRMA UNA ORDEN QUE PROHÍBE ""CUALQUIER"" TRANSACCIÓN CON LA EMPRESA TIKTOK J TikTok agricultura","https://www.instagram.com/p/CDmH9dxlpGT/","photo","67,391","radioagricultura"
"358",2,"Jul 22, 2020 @ 15:22:23.000","La Nación","47","44","3","El animador de Canal 13 fundamentó su decisión en que la red social ""es un lugar en el que abundan las noticias falsas y tiene una velocidad muy alta de propagación"". Además dijo que escribió muchas veces a los encargados de la plataforma denunciando matonaje, insultos y homofobia, pero que ""nunca hicieron nada"".
📲Lee más en nuestro sitio web (link en la biografía).
#panchosaavedra #twitter #cerro #cuenta #montaje #homofobia #insultos","(empty)","https://www.instagram.com/p/CC9LfxIHxMw/","photo","7,792","lanacioncl"
"359",1,"Jul 18, 2020 @ 20:00:31.000","La Voz de Pucón","19","13","6","La posibilidad de que el eclipse de diciembre próximo sea cerrado en Pucón por la pandemia —es decir, que no no pueda ingresar gente externa y que solo sea posible apreciar el fenómeno cósmico vía plataformas virtuales— fue un tema que golpeó y alertó a las autoridades locales y a los empresarios. Esto, porque el evento, según varios reconocen, es un “salvavidas” para las golpeadas arcas de las pymes turísticas locales que no reciben ingresos desde mediados de marzo y que tiene a varias al borde de la quiebra. Pero lo de cerrar para el eclipse no es algo definido. Al menos así lo señala el seremi de Economía, Francisco López, quien explicó que la interpretación de cierre fue más bien un problema comunicacional.⁣⁣
⁣⁣
“Eso obedeció a una desinformación. El gobierno nunca ha planteado esa posibilidad, sino que al contrario, nosotros estamos haciendo todo un esfuerzo y trabajo para poder bajar las cifras de la región, las cifras de covid. Y en ese sentido ir permitiendo una apertura y un desconfinamiento que signifique llegar a diciembre con la posibilidad de recibir turistas”, aclara la autoridad regional, quien agrega que se debe ir “paso a paso” en el proceso de desconfinamiento y que todo esto será manejado por el ministerio de Salud: “Son ellos quienes dan las directrices para que la región se encuentre en una situación sanitaria oportuna para poder recibir turistas de acuerdo a los parámetros que ellos manejan. En estos momentos el ministerio de Salud está abocado en un cien por ciento a bajar las cifras de contagio, porque si bien la región está en un buen pie para un futuro desconfinamiento, tenemos que hoy día más que nunca inculcar el autocuidado porque va a ser la única política pública efectiva que nos va a permitir una apertura económica en el futuro”.","(empty)","https://www.instagram.com/p/CCzYI_WBDOs/","video","9,095","lavozdepucon"
"360",3,"Jul 11, 2020 @ 12:34:30.000","El Diario De Antofagasta","37","37","0","‪En el #DiaDelPeriodista saludamos a nuestros colegas de la región de #Antofagasta y el país.‬
‪En época de crisis, fake news y posverdad, el periodismo es más importante que nunca para develar las verdades, aunque duelan.

‪“El periodismo es libre e independiente o es una farsa”‬","(empty)","https://www.instagram.com/p/CCgjiiZFD16/","photo","24,201","diarioafta"
